artist,genre,lyric,date
4minute,댄스,Yeah This is my first storySay Oh oh oh baby la la la la laSay Oh oh oh honey la la la la la정말 너 웃겨 남자는 다 똑같애뭘 모르고 눈치없고나원참 기가막혀 미치겠어머리를 바꾸고 새로산 구두를 신고어떠냐고 물어봐도도대체 뭐가 뭔지 모르는 너내맘을 풀어줄땐 너의 Credit Card대신 Show me a true for heart언제나 네맘은 보일듯 말듯내게 좀 표현해줄래사랑한단 말 한 마디언제까지 망설이고 있을거니Oh 늘 부터는 내게 좀 말해줘One 손잡을때 깍지 끼기Two 짜증낼때 웃어주기몰라 몰라 몰라 몰라 몰라 몰라말해도 너는 몰라Three 문자보단 전화하기Four 눈맞추며 얘기하기몰라 몰라 몰라 몰라 몰라 몰라왜 맘을 정말 몰라You don't know what a girl wantsWhat a girl What a girl wants더 크게 크게 내게 말해줘Again Again 내게 보여줘You don't know what a girl wantsWhat a girl What a girl wantsOh 좀더 좀더 옆에 있어줘I do I do 약속해줘우리 만나고 얼마나 지났는데백일인지 천일인지어쩌면 내 생일도 지나치니그럴 수도 있어 아니 뭐 괜찮은걸하지만 너 그래도 너내 전화번호조차 모르니 Oh badJust she bling bling 악세사리보다 웃어주는 너의 두 눈이I want it want it No너 너만 있어 주길Oh 언제나 네 맘 속에 있는사랑이란 두 글자의 믿음오늘 부터는 내게 좀 보여줘One 손잡을때 깍지 끼기Two 짜증낼때 웃어주기몰라 몰라 몰라 몰라 몰라 몰라말해도 너는 몰라Three 문자보단 전화하기Four 눈맞추며 얘기하기몰라 몰라 몰라 몰라 몰라 몰라왜 맘을 정말 몰라Say Oh oh oh baby la la la la laSay Oh oh oh honey la la la la laYou don't know whatYou don't know whatWhat a girl wantsYou don't know whatYou don't know whatWhat a girl wantsOne 손잡을때 깍지 끼기Two 짜증낼때 웃어주기몰라 몰라 몰라 몰라 몰라 몰라말해도 너는 몰라Three 문자보단 전화하기Four 눈맞추며 얘기하기몰라 몰라 몰라 몰라 몰라 몰라내 맘을 정말 몰라You don't know what a girl wantsWhat a girl What a girl wants더 크게 크게 내게 말해줘Again Again 내게 보여줘You don't know what a girl wantsWhat a girl What a girl wantsOh 좀더 좀더 옆에 있어줘I do I do 약속해줘You don't know what a girl wants ,2009.08.28
태사비애,발라드,너도 이 노래만 들으면내가 보고 싶어 질꺼야노랫말에 너와 내가 있잖아사랑을 했었고 헤어지고보고 싶어 하는 게 마치 우리 같잖아기억하니 우리 함께 했던그때 니가 좋아하던 노래내가 불러주던 노래여전히 이어폰엔 아직도 흐르는데여전히 거리 위엔 이토록 가득한데너는 없어모든 건 그대론데 너만 없어이 음악은 흐르는데 영원히 함께 듣자약속했었는데 난 울고 있어너도 이 노래만 들으면내가 보고 싶어 질꺼야노랫말에 너와 내가 있잖아사랑을 했었고 헤어지고보고 싶어 하는게 마치 우리 같잖아티비 쇼에 나오는 익숙한 멜로디라디오에 흐르는한편에 슬픈 사연이 마치너와 내가 했던 이야기 같아바보같이 난 눈물만 흘렸지만난 며칠을 참아왔는데 맨날너와 걷던 거리만 걷게 되는 건데왜 이 노래만 들으면난 니가 걱정이 돼어디선가 너도 눈물을 흘릴 테니까내가 먼저 헤어지자 해놓고이 노래를 들으며 울기는또 왜 우는 건데이 꼴이 한심해정말 너랑 헤어지고모든 게 잘못된 걸 알았으니까제발 이 노래를 듣고서니가 돌아오면 좋겠어노랫말엔 둘이 다시 만나서사랑 한다고두 번 다시 헤어지지 말자고그런 맹세하잖아너도 이 노래만 들으면내가 보고 싶어 질 꺼야노랫말에 너와 내가 있잖아사랑을 했었고헤어지고 보고 싶어하는 게 마치 우리 같잖아 ,2009.09.10
박기영,발라드,못믿겠어 헤어지잔 너의 말왜 이러는데 내게 왜 이러는데만우절도 아닌데 왜 거짓말을 해무슨 농담하는 거야뭐라도 찍고 있는 거야지금 누가 보고 있다면내 이별을 보고 있다면거짓말이라 해줘결국 마지막에 잘될 거라고드라마의 한 장면처럼녹화된 테잎을 감듯이처음으로 다시우리 사랑했던 그때로돌아갈 거라고지나가는 아무라도 붙잡고묻고만 싶어지금 날 속이냐고카메라를 찾아서내게 보여주며웃을 것만 같은데이게 다 정말인가 봐지금 누가 보고 있다면내 이별을 보고 있다면거짓말이라 해줘결국 마지막에 잘될 거라고드라마의 한 장면처럼녹화된 테잎을 감듯이처음으로 다시우리 사랑했던 그때로돌아갈 수 없단 걸 알아모두 정말인 것도 알아이렇게 가슴이 아프고내 눈물도 너무 짜니까하지만 하늘이 있다면정말로 날 보고 있다면앞으로 감아줘녹화된 테잎을 감듯이 ,2009.08.25
태군,댄스,니가 떠났고아무 일 없듯 웃어넘겼고뒤돌아섰는데 애써 지웠는데지금 와서 날 돌아오라고아니야 넌 모두 거짓말잠시뿐인 그런 뻔한 말내 눈을 맞춰도내 몸은 안아도자꾸만 니가 싫어지고이런 내가 속았다 속았다 속았다그래 너를 믿었다 믿었다 믿었다너는 나를 떠났다 떠났다 떠났다이미 나는 널 널 지웠다내가 속았다 속았다 속았다그래 너를 믿었다 믿었다 믿었다너는 나를 떠났다 떠났다 떠났다이미 나는 널 널 지웠다니가 웃었고아무 일 없듯 나를 만졌고단둘이 뿐인데날 유혹 하는데예전처럼 날 안고 싶다고아니야 넌 모두 거짓말잠시뿐인 그런 뻔한 말내 눈을 맞춰도내 몸을 안아도자꾸만 다른 남자 손길이런 내가 속았다 속았다 속았다그래 너를 믿었다 믿었다 믿었다너는 나를 떠났다 떠났다 떠났다이미 나는 널 널 지웠다내가 속았다 속았다 속았다그래 너를 믿었다 믿었다 믿었다너는 나를 떠났다 떠났다 떠났다이미 나는 널 널 지웠다아니야정말 그런 거 아니야나 너밖에 없는 거 몰라왜 그래 이러지마이러지마 난 싫어더 이상은 안속아이젠 안 믿어 어 다신 안 믿어 어어 어 어 어 어 어 어 어이런 내가 속았다 속았다 속았다그래 너를 믿었다 믿었다 믿었다너는 나를 떠났다 떠났다 떠났다이미 나는 널 널 지웠다내가 널 믿을 것 같애됐거든 그만하자니 갈 길가라 ,2009.09.17
화요비,댄스,차가운 세상에서 나를 감싸주는너는 나의 전 재산난 너만 보면 가슴이 떨려와yeh That's right세상이 너를 속인대도나는 k i s s i n g u포근히 나를 감싸줄 때 말할게l o v e y o u하루가 1년같이 무거운 니 어깨에비올 때 우산 같은곧 날 것 같은 그런 사랑 너만 줄게Wherevar whatevar I think of U그 어디서 뭘하고 있어도난 오직 너의 생각 뿐인걸AlwayZ be ma baby 4 ever언제나 니 옆에서 힘이 되도록나 항상 널 지켜줄거야너만 있으면 어디라도 내겐p a r a d i s e자꾸 들어도 듣고 싶어baby I l o v e y o u사랑해 한마디로 끝내 날 울리는 널1초도 안 잊을게 더 사랑할게이젠 내가 안아 줄래Wherevar whatevar I think of U그 어디서 뭘하고 있어도난 오직 너의 생각 뿐인걸AlwayZ be ma baby 4 ever언제나 니 옆에서 힘이 되도록나 항상 널 지켜줄거야가끔씩 우리 눈물이 날 때면따뜻한 니 손 잡고두 눈 꼬옥 감고달콤한 입술 더 가까이 와Wherevar whatevar I think of UAlwayZ be ma baby 4 everWherevar whatevar I think of U그 어디서 뭘하고 있어도난 오직 너의 생각 뿐인걸AlwayZ be ma baby 4 ever나 항상 널 지켜줄거야차가운 세상에서 나를 감싸주는너는 나의 전 재산난 너만 보면 가슴이 떨려와yeh That's right어두운 세상에서 빛을 밝혀주는 넌나의 태양 you make me smilecan't stop loving you넌 나의 구세주 ma boo I love you ,2009.08.06
김정훈,발라드,기다릴 수 있겠니 나 없는 동안에너의 생일도 발렌타인 데이도함께 있지 못해 혼자 힘이 들텐데두고 가서 미안해비가 오는 그런 날에는 더 생각날꺼야빗소리에 많이 보고 싶겠지어디에서 너도 나와 똑같이잠 못 이루며 그리워할 생각에I love you So I love you니가 자꾸 눈에 밟혀서내 심장에 니가 밟혀서어떻게 떠나가겠니Oh I love you And I love you so저기 차를 타는 그 순간울지 말고 손 흔들어 줘제발 잘 있어줘멀어지는 니 모습 붙잡고 싶지만눈물 삼키며 이름만 불러본다제일 예쁜 사진 한 장 가지고 갈게나 없이도 건강해우리 그 동안에 만났던 수 많은 날 두고변하지 말란 말도 하지 못했다어느 누군가가 말을 건네도냉정한채로 이 한마디만 기억해Oh I love you So I love you니가 자꾸 눈에 밟혀서내 심장에 니가 밟혀서어떻게 떠나가겠니Oh I love you And I love you so저기 차를 타는 그 순간울지 말고 손 흔들어 줘 제발 잘 있어줘 ,2009.09.01
홍경민,발라드,그저 잘 지내라는 말로마지막 인사만을 남기고조용히 가방을 들고서그녀가 걸어 나간다헤어질 때면 아쉬워서몇번씩이나 뒤돌아보던 그녀가오늘은 망설임 없이 그렇게 간다왜 그러냐고 앉아보라고잡을수가 없어부딪혀버릴 손길이 난 두려워어제부터 준비했던하고픈 말 많았는데다신 아프게만들지 않겠다고이제부턴 우릴 위해 모든걸 걸겠다는마지막 그 말도 못들은채그녀가 간다다신 볼수 없을거라고나지막하게 말하던 그녀 모습이남겨진 초라한 나를 자꾸만 돌아지금이라도 다시 내게로와 줄 것 같은데텅 빈 이곳엔아무도 오질 않아어제부터 준비했던하고픈 말 많았는데다신 아프게만들지 않겠다고이제부턴 우릴 위해 모든걸 걸겠다는마지막 그 말도 못들은채그녀가 간다흐르는건 나의 눈물타버린건 나의 가슴이제 어떻게 견뎌야 하는건지넋이 나간 사람처럼멍하니 그 자리에움직일 수 없는 나를 두고그녀가 간다 ,2009.08.20
윤도현,발라드,"매일 아침마다 지저귀는창밖의 저 새가너라면 참 좋으련만벌써 연락안된지가한달 두달이 넘었어정말 우린 헤어졌나내 사랑은 진짜 사랑 아니라고친구들은 말했지만듣지 않았어 믿지 않았어그래서 후회만다시 사랑하지 않을래사랑하지 않을래다시 사랑하지 않을래사랑하지 않을래매일 아침 퉁퉁부은 두 눈부끄러워 미치겠어그래 미워하지 않을래미워하지 않을래

펼치기

",2009.09.18
티맥스,댄스,나나나나나 나나나나나 나나나나나눈빛을 원해 더 바라봐주길손길을 원해 꽉 잡아주길입술을 원해 쪽 맞춰주기를 원해꼭 안아주길 바래하늘이 무너진대도 땅이 푹 커진대도세상 끝났다해도 난 너에게로 GO GO널 보는 지금 터질 듯 한 내 가슴자꾸 널 볼 때마다 왜이리 떨리나이런 내 맘 넌 모르지만지겹게도 지치게도 하지만짜증 싫증도 나겠지만하나만 기억해 나는 널 사랑해눈빛을 원해 더바라봐주길 hey손길을 원해 꽉잡아주길입술을 원해 쪽맞춰주기를 원해꼭 안아주길 바래나나나나나 나나나나나 나나나나나나나나나나 나나나나나 나나나나나항상 맘속에 너니까너만 바라보는 나니까나에겐 오직 너 하나뿐이니까그저 맘이 가는대로자꾸 더 끌리는 대로내게로 다가 가는대로 왜이리 떨리나이런 내 맘 넌 모르지만지겹게도 지치게도 하지만짜증 싫증도 나겠지만하나만 기억해 나는 널 사랑해눈빛을 원해 더바라봐주길 hey손길을 원해 꽉잡아주길입술을 원해 쪽맞춰주기를 원해 hey꼭 안아주길 바래하나만 약속해 오래 오래 함께해나와 둘이서내 곁에 너밖에 어울리는 건너 하나뿐야나나나나나 나나나나나 나나나나나나나나나나 나나나나나 나나나나나눈빛을 원해 바라봐주길손길을 원해 잡아주길입술을 원해 맞춰주기를 원해원해 난 너만 사랑해 ,2009.09.03
김범수,발라드,"누가봐도 아닌 비주얼에가진것 하나 없던 나누가 봐도그럴수록 난 더 강해졌어내 삶의 전부를 걸었어사람들의 비웃음 오나에게는 Vitamin 바이타민길거리 TV Radio 속내 음악이 나와도 아무도날 모르는나는야 얼굴 없는 가수그래도 나는 감사해내 노래가 스타라면아무도 날 몰라줘도 OK노래는 내 삶의 추억이그 무엇보다 빛나는 걸급할건 없어 slo
				",2009.09.11
라이언,발라드,우두커니 너를 보는내 모습 참 너무나 우스워입가엔 미소가 가득히 고여선 말이야너를 보는 내 눈이 촉촉하게니 맘을 만지고 있나봐좋아해 라고하면 쑥스럽다 못해 창피해참 고마워 너 때문에 행복하게 돼서어쩌면 평생 모르고 살뻔 했어이제야 그걸 알아 참 다행이야어쩌면 모르고 그냥 널지나쳤을지도 몰라 나사랑해 널 사랑해 지금 말 못 해도평생 널 지키며니 옆에 서 꼭 안아줄게자랑해 널 자랑해 늘 내게 자랑해다른 누구보다 예쁜 널 자랑해사랑해 널 이렇게 나널 향한 내 맘이 촉촉하게니 맘을 만지고 있나봐고마워 라고하면미소가 아닌 눈물이나참 고마워 너 때문에 행복하게 돼서어쩌면 평생 모르고 살뻔 했어이제야 그걸 알아 참 다행이야어쩌면 모르고 그냥 널지나쳤을지도 몰라 나사랑해 널 사랑해 지금 말 못해도평생 널 지키며 니 옆에서 꼭 안아줄게자랑해 널 자랑해 늘 내게 자랑해다른 누구보다 예쁜 널 자랑해사랑해 널널 사랑해 널 사랑해 지금 말 못해도평생 널 지키며 니 곁에서너만을 안아 줄꺼야자랑해 널 자랑해 늘 내게 자랑해다른 누구보다 예쁜 널 자랑해사랑해 널 이렇게 나 ,2009.09.08
김건모,발라드,흔들리는 그대를 보면내마음이 더 아픈거죠그댈 떠나버린 사람이누군지 몰라도이젠 다 잊어주길 바래요한없이 울고 싶어지면울고 싶은만큼 울어요무슨 애기를 한다해도그대의 마음을위로할 수 없는 걸 알기에난 어쩌면 그 사람과의 만남이잘 되지 않기를바랬는지도 몰라요그대를 볼때면 늘 안타까웠던거죠우리의 만남이조금 늦었다는 것이이젠 모든걸 말할 수 있어요그 누구보다 그댈 사랑했음을세상이 그대를 속일지 몰라도내가 그대곁에 있음을 기억해요난 어쩌면 그 사람과의 만남이잘 되지 않기를바랬는지도 몰라요그대를 볼때면 늘 안타까웠던거죠우리의 만남이조금 늦었다는 것이이젠 모든걸 말할 수 있어요그 누구보다 그댈 사랑했음을세상이 그대를 속일지 몰라도내가 그대곁에 있음을 기억해요이젠 모든걸 말할 수 있어요그 누구보다 그댈 사랑했음을세상이 그대를 속일지 몰라도내가 그대곁에 있음을 기억해요 ,2009.09.15
가비엔제이,발라드,핼쑥해졌대 얼굴이 반쪽이래친구가 하는 말내가 걱정된다고난 괜찮다고 정말 괜찮다고웃어봐 다시 큰소리로 웃어봐밥도 잘 먹고 씩씩하고 싶은데그게 잘 안돼 행복하고 싶은데다 너 때문에못된 너 하나 땜에그 흔한 다른 사랑 못해어떡해야 해다시 처음처럼 사랑하자꼭 한번만 우리 정말 사랑하자늘 하고 싶은 말내 맘에 박혔나 봐이말 밖에 생각안나사랑했던 만큼 미워하자그럴수록 하루하루 보고싶어나 정말 아픈데 죽을 것 같은데눈물이 안나와웃음이 없대 말수도 적어졌대친구가 하는 말이젠 보내주라고다잊었다고 정말 다 잊었다고말을 해 자꾸 맘에 없는거짓말을 해다시 처음처럼 사랑하자꼭 한번만 우리 정말 사랑하자늘 하고 싶은 말내 맘에 박혔나 봐이말 밖에 생각안나사랑했던 만큼 미워하자그럴수록 하루하루 보고싶어나 정말 아픈데 죽을 것 같은데눈물이 안나와다들 이별하잖아그까짓 사랑이 다 뭔데매일 널 욕해봐도맘처럼 그게 잘 안되나봐그래 내일부터 잊어보자오늘까지 우리사랑 기억하자왜말을 안듣니점점 더 선명해져너 밖에 난 생각안나사랑했던 만큼 미워하자그럴수록 하루하루 보고싶어나 정말 아픈데 죽을 것 같은데눈물이 안나와 ,2009.09.24
휘성 (Realslow),R&B;/Soul,너무 행복했어 그게 늘 불안했어언젠가 이별이 꿈을 깨듯 올테니니가 없어도 나 겨우 살 수 있도록각오 쯤은 하면서 오늘을 준비했어나를 떠나가는 널 그저 이해하는 척슬프지 않은 척 괜히 남자다운 척어깨를 펴고 한 손을 내밀고보기좋게 보내주려 했었는데참 말이 없던 하늘은끝내 내편이 아닌듯마른 날씨에 검은 구름은oh 하나 둘씩 몰고 들어왔어난 울음을 참는데어느새 내 얼굴에주르르르륵 주르르르륵굵은 빗방울 내려 꼭 내가우는 것처럼 오해하게 만들어내가 싫어졌는지 뭐가 지겨웠는지묻고 싶은 맘이 목을 졸라도난 더 밝게 웃으며 말할거야참 좋은 사랑만 했다고bye bye byebaby 난 난 난평생 영원히 소중히간직될 고마운 사랑 안녕갈 곳이 없다면 그저 비켜주려해몰래 네 소식만 찾아서 들을께허락해줄래 나 혼자 숨어서너를 추억하는 일은 할수있게난 너란 사람 만나서사랑이란 걸 배웠어그 값진 맘난 잊고 다음 생에도널 다시 만나길 빌꺼야난 울음을 참는데어느새 내 얼굴에주르르르륵 주르르르륵굵은 빗방울 내려 꼭 내가우는 것처럼 오해하게 만들어내가 싫어졌는지 뭐가 지겨웠는지묻고 싶은 맘이 목을 졸라도난 더 밝게 웃으며 말할거야참 좋은 사랑만 했다고난 해준게 너무나도 없어서보내줄 때 지어줄 기억이 필요했어맑은 공기와 잔잔한 바람멋진 이별 만들고 싶었는데난 울음을 참는데어느새 네 얼굴에주르르르륵 주르르르륵굵은 빗방울 내려 꼭 내가우는 것처럼 오해하게 만들어내가 싫어졌는지 뭐가 지겨웠는지묻고 싶은 맘이 목을 졸라도난 더 밝게 웃으며 말할거야참 좋은 사랑만 했다고bye bye byebaby 난 난 난평생 영원히 소중히간직될 고마운 사랑 안녕bye bye byebaby 난 난 난평생 영원히 소중히간직될 고마운 사랑 안녕 ,2009.10.08
배치기,랩/힙합,작년 겨울 카페에한 남자와 함께 있던 너날 보자 당황하며말을 잇지 못했지다시는 이런일없을거라 너 말하며우는 널 아무 말 없이 나그저 받아 주었어죽을 때 까지나만 바라본다 말하는 널조용히 두 엄지로눈물 닦아 주었지만차라리 그때사실을 말하지 않았다면아니 그래야겠어 넌 알아야 했어한 순간도 내 손에서전화길 놓지를 못해받지 않는 동안은내 심장이 타들어가네집앞 골목길 몰래 숨어니가 오길 기다려니 모습 보일땐부디 혼자이길 기도하며홈피속 니 흔적들을찾아가며 밤을 새워정신을 차리면끔찍한 날 본 후 잠이 들어눈 뜨면 널 따라걷고있는 미친 나를 봐혹시 이런 날 알까점점 두려워 난사랑해 너를 사랑해미워해 너를 미워해나를 떠나가지 말아줘다시 돌아온다 말해줘사랑해 너를 사랑해check서로만을 바라봤던 시간 속에멈춰서 난 헤메마취제 같은 술에 기대뚫린 가슴 꿰메익숙해 너를 만난 시간동안골백번이고 했으니까아프지않아나는 제발 니가 떠나가지않기만을 바랄 뿐이니까넌 숨이 자꾸 막힌다며내 존재가 널 괴롭힌다며꺼지라고 밀어내도우리 미래 그려갔던그 순간이 생각나 난 웃어어이없어 하는눈빛조차 아름다워서너가 말하는 순간 얼굴을 잡고억지로 했던 키스그 어떤 유혹을들이대도 참을 수 있어넌 미워해라 난 사랑할게갈갈이 조각이 나버린우리 지난 날을 쓸어담아너의 걸음걸이 마다내가 뿌려줄게넌 돌아올거라는 믿음 아래내가 살잖아 알잖아대체 어느 누가 나만큼너를 사랑할 수 있을지한번 생각해봐제발 그래니 말대로 난 소심해진실을 말하지마제발 나 심장이멎는듯해 네 손끝에uh 망가져가는 나를 봐줘제발 나날이늘어가는 의심 속에갇힌채 나 너를 기다리며너를 그려보다다시 너의 품에잠이 드는 꿈을 꿔사랑해 너를 사랑해미워해 너를 미워해나를 떠나가지 말아줘다시 돌아온다 말해줘사랑해 너를 사랑해여전히 너의 곁에 없는 나더이상 숨을 쉴 수 없어돌리고 싶어오늘도 널 향한 매듭을 더한내 모습 속에값싼 동정도 좋다며구걸하는 내 거짓 속에무너져가는내 자신을 잘 알지만나조차 제어가 안되는가슴을 움켜쥐고서처음 본 그 날처럼 너를 반겼어빛 바랜 우리의 라일락흩어진 향기와 나의 맘어느새 깊어진 너의 손길아직은 놓지못해 너를 원해사랑해 너를 사랑해사랑해 너를 사랑해미워해 너를 미워해미워해 너를 미워해나를 떠나가지 말아줘다시 돌아온다 말해줘사랑해 너를 사랑해,2009.09.28
"유이 (애프터스쿨), 전진, 숙희",댄스,그 남자가 나를 보고 있다커튼을 열고물을 마시고햇살이 비친 창문을 보다ah ah ah ah ah그녀의 눈을 마주쳐 버렸다bring bring baby fall in loveslow slow baby i love you too나는 그의 눈과 마주쳤다 it's love그녀의 눈을 난 피해버렸지만내 심장이 뛰고 있다더 이상은 감출 수가 없어내 마음을 i can't stop미쳤어 미쳤나봐처음 본 남자에게 끌려이래도 나 되는 걸까아직도 가슴이 떨려i love you oh i love you머리 속 너로 가득 채워사랑해 i wanna know you오늘밤 내게 와줘요시계를 보고커필 마시고신발을 신고 외출을 하고ah ah ah ah ah지금 그녀의 집 앞에 서있다bring bring baby fall in loveslow slow baby i love you too창문밖에 그 남자가 있다 oh no초인종을 난 누르고 싶었지만용기가 나질 않는다더 이상은 감출 수가 없어내 마음은 i can't stopi love you oh i love you머리 속 너로 가득 채워사랑해 i wanna know you오늘밤 내게 와줘요한걸음도 뗄 수가 없어나는 널 놓칠 수가 없어더 이상 널 참을 수 없어사랑해 사랑해요이렇게 바라보고 있죠이대로 나 달려가서그대를 안고 싶어요그녀의 입술그녀의 눈빛그녀의 얼굴 눈이 부셨다ah ah ah ah ah그녀와 나는 이렇게 만났다 ,2009.09.24
MC몽,"댄스, 랩/힙합","시베리안 야생 수컷 호랑이나는 리듬을 잡아먹는 마법사니들의 맘을 사로잡는 MCMC몽이여 영원하라캄캄한 캄캄한이 밤의 놀래킬라아무도 모르게번개보다 빠르게악동의 무대킬라뻔뻔한 드라큘라겁내지 말고Welcome to the horror show에헤라디야 놀아볼란다지친 밤이라도에헤라디야 놀아볼란다믿고 따라와줘지친 영혼을 어루고 달래는특급 호러쇼사회의 법도 규칙도 등급도오늘 밤만큼은 필요없어Welcome to the 몽키홈깜짝 놀랄 스위밍 쇼온몸이 확 소름이 쫙어둠을 밝혀줘Hello we nowDr.Monkey's timeEverybody come to life모두 모두 일어나모두 모두come to life캄캄한 캄캄한이 밤의 놀래킬라아무도 모르게번개보다 빠르게악동의 무대킬라뻔뻔한 드라큘라겁내지 말고Welcome to the horror show캄캄한 캄캄한캄캄한 밤에 위트는 따다다 따발총 소리12시 땡 하면 좀비여 모여라주문을 걸어봐부리디 밥밥빼지좀 마흔들어봐 보일락 말락time to rock보름달 뜨면은늑대로 변해요아우둘이 to cabinet M fire사랑과 인생가모리 까여일어나 higher 어둠의 fire죽지 않는 vampireDr.Monkey's timeEverybody come to life모두모두 일어나 모두모두come to life캄캄한 캄캄한이 밤의 놀래킬라아무도 모르게번개보다 빠르게악동의 무대킬라뻔뻔한 드라큘라겁내지 말고Welcome to the horror showyo Show me what you gotREMIX아 오른쪽 아 왼쪽 아겁내지 말고아 오른쪽 아 왼쪽 아소름이 끼치게아 오른쪽 아 왼쪽 아그녀들을 모셔아 오른쪽 아 왼쪽 아to the horror show세상에 지쳐 버릴 즈음넌 겁내지 말고겁내지 말고둥근 밤이 빛나고 태양은 뜰꺼야실패가 뒤를 따라도넌 두려워 말고 두려워 말고 그대의 슬픔이 빛나고태양이 뜰꺼야
				",2009.10.06
