artist,genre,lyric,date
원써겐,랩/힙합,사랑이란 말은 아직도 난 어색해부족해 이렇게 난 바보같은데그래도 난 너와 있는게 좋아표현은 서툴지만 계속 생각나말하긴 힘든데 왜 나는 자꾸사랑한단 말이 입에 맴 돌구왠지 너만 보면 따뜻해져허전한 내 맘이 가득해져I need you서로의 아픔을 다 알순 없지만그래도 조금씩 다가갈게너에게 다 줄게 놓치 않을게거쎈 소나기 거친 바람이우릴 갈라놓을수록널 더 잡을게 나만의 그대내게로 기대Cause I wanna fall in love with you나의 사랑아Fall in love with you너와 둘이서언제나 우리 함께 할수있게항상 for everyday난 기도해 for you and meI love you so하지만 때론 세상 살다가지쳐 내려놓고 다버리고 싶을때도 있어겁내지마 내 품안으로 와울고 싶을땐 조용히 내곁으로 와just be with me나를 믿어주겠니그래 내가 가진건 아직 모잘라너를 위해서 그래 난 계속 달리겠어내 손 작지만 잡아줘I need you하늘과 바다처럼 우린 서로를 비춰지쳐있어도 나는 너를 보며 웃어내가 힘들때 너도 그 자릴 지켜줘매일 또 내 모든것을제일 보여줄수 있는너와 함께라서 행복해이제 두 손을 이리내Cause I wanna fall in love with you나의 사랑아fall in love with you너와 둘이서언제나 우리 함께 할수있게항상 for everyday난 기도해 for you and meI love you so이런 내 맘이 쉽게 들키면왠지 희미해질것만 같아 난 숨겼어하지만 시간이 흐를수록숨길수가 없는걸너만을 위한 난 falling in love사랑한단 말이 내겐 쉽게떨어지지 않지만 고백 할게세상 끝날까지 내겐 너 하나어떤것도 난 두렵지 않아거쎈 소나기 거친 바람이우릴 갈라놓고 더 멀리 밀어내도나만의 그대 내게로 기대Cause i wanna fall in love with you나의 사랑아fall in love with you너와 둘이서언제나 우리 함께 할수있게항상 for everyday난 기도해 for you and mefall in love with you함께 할수있게 for everyday난 기도해 난 기도해 ,2009.03.05
룸메이트,발라드,그대 반대편에 서야나의 그림자는 쉴 수 있어요낮동안 그대를 잊고 지낸 고통에너무 높이 떠 있어서나의 목소리가 들리지 않겠지만내 향기는 느끼죠해가 뜨기 전에 내가 닿을 수 있게매일 난 기도하는데나 여기 있어요 나를 보고 있나요오늘도 그대 빛은 나를 깨워요억겁의 계절을 지나셀 수 없이 꺾이고 밟혔어도한가지 믿음에 나는 다시 태어나그댈 바라보는 운명그대의 빛으로 살아가야 하는 소명I am Evening primrose해가 뜨기 전에 내가 닿을 수 있게매일 난 기도하는데나 여기 있어요 나를 보고 있나요오늘도 그대 빛은 나를 깨워요우리의 거리가 남들과 다르지만영원히 그댈 보려고나 꽃이 되었죠 환하게 피었어요밤하늘에 뿌려진 저 별들처럼잠에 빠진 세상은 그댈 위한 시간영원히 죽지 않을 나의 사랑을들어줘요그대가 있는 곳 나는 갈 수 없나요그대 그 빛으로 나는 시들지 않아어둠 속 날 깨워줘요나 여기 있어요 나를 보고 있나요오늘도 내 향기를 올려보네요우리의 거리가 남들과 다르지만영원히 그댈 보려고나 꽃이 되었죠 환하게 피었어요그대 곁에서 사는 별들처럼요 ,2009.02.23
빅마마,발라드,눈물이 차갑게 흘러요보이지 않는 외로움 속에서지쳐버린 하루를보며한숨만 쉬네요 잊어야한다고날 지켜주겠다고 날 사랑한다고약속했던 말들도 다 거짓이였나요내 기억속의 그대 자리는아직 그대론데내 눈을 보아도사랑이 느껴지지 않나요가지말라고 붙잡고 싶어도그댈 위해 난 참아야겠죠다 거짓이였나요내 기억속의그대 자리는 아직 그대론데내 눈을 보아도사랑이 느껴지지않나요가지말라고 붙잡고싶어도그댈위해 난 참아요심장이 멈출것같아오늘도 널 비워내기가 쉽지않아잊지말라고 날 잊지말라고차마 할 수 없는 그 말still love youi love you i love youi love you forever느껴지지 않나요가지말라고 붙잡고 싶어도그대 위해 난 참아요잊지못한 내 소중한 사랑잊지못한 내 소중한 사람 ,2009.02.13
서문탁,"발라드, 록/메탈",너무나도 많은 날들을그 수많은 입맞춤들너의 그 숨소리마저모두 간직하고 싶었어너의 얼굴은 사진속으로너의 마음은 일기장속으로너의 모든걸 남기고 싶었어너무 많은 눈물너무 많은 약속너무 많은 기다림에 지친 날들 위로지나친 바램들 때문에바보같은 나의 욕심 때문에미안해 용서해너무 많은 모든걸 후회해너무나 부족한 날너의 얼굴은 사진속으로너의 마음은 일기장속으로너의 모든걸 남기고 싶었어너무 많은 눈물너무 많은 약속너무 많은 기다림에 지친 날들 위로지나친 바램들 때문에바보같은 나의 욕심 때문에미안해 용서해너무 많은 모든걸 후회해너무나 부족한 날빛바랜 사진들만이너의 기억을 자라나게 하고먼지 속 책장의 일기장속엔너의 빈 목소리만너무 많은 눈물너무 많은 약속너무 많은 기다림에 지친 날들 위로지나친 바램들 때문에바보같은 나의 욕심 때문에미안해 용서해너무 많은 모든걸 후회해너무나 부족한 날 ,2009.03.10
윤화재인,발라드,머리를 자르고애써 웃어보고너를 만나러갈 준빌한다애써봐야 애써봐야니맘은 이미 식은걸 안다험하게 욕하고미친 듯 울어도네겐 미련해 보일 뿐인걸애써봐야 애써봐야모두 끝나버렸단걸 안다Don't leave me nowDon't leave me now어떻게 널 잊고 살아가니시작이 같았던 사랑아이런 마지막을 보게 하니지독했던 내 사랑도30분 후면 끝나겠지만내겐 30년이 지나도겨우30분전 같을 꺼야밤새 거칠어진 얼굴이 미워서자꾸만 화장을 고쳐봐도애써봐야 애써봐야너에겐 내가 제일 미운 사람함께 사랑하고 혼자 이별하니남은 내 반쪽 사랑만으론애써봐도 애써봐도비틀거릴 내 모습만 남아Don't leave me nowDon't leave me now어떻게 널 잊고 살아가니시작이 같았던 사랑아이런 마지막을 보게 하니지독했던 내 사랑도30분 후면 끝나겠지만내겐 30년이 지나도겨우30분전 같을 꺼야이런날 어떡해Don't leave me now ,2009.03.05
김현중,발라드,"행복이 무엇인지 알 수는 없잖아요",2009.03.18
김소리,댄스,,2009.02.19
썸데이,발라드,아나요 그대는 느끼죠 그대도가슴이 말하고 있는 사랑이란걸요들려요 그대는 보아요 그대도꽃처럼 피어나는 수줍은 내 맘을난 햇살에 눈이 부신싱그런 아침이 오면사랑에 눈을 뜨며 노랠하죠오직 그대 하나만 위해서For you I love only you설레이는 마음 가득해향기로운 커피처럼 부드러운내 숨결을 그대만 보네요안겨요 그대가 내품에 잠들죠등뒤에 기대고 싶은걸 사랑이란걸요달콤한 그대의 입술과 손길은모든걸 감싸고 행복을 주네요서로만 바라봐요 우리손을 꼭 잡아요행복한 기분이죠 눈부신 운명이죠사랑의 향기에 취해보아요그대 내 눈을 보아요설레이는 마음 가득해마법같은 키스처럼 따사로운이 마음을 그대는 알까요아나요 그대는 느끼죠 그대도심장이 두근거리는걸 잡을수 없어요숨어도 보이죠 그대는 화려한꽃보다 더 아름다운 사람이랍니다서로만 바라봐요 우리 손을 꼭 잡아요행복한 기분이죠 눈부신 운명이죠사랑의 향기에 취해보아요 영원히아나요 그대는 느끼죠 그대도가슴이 말하고 있는건 사랑이란거죠우리를 비추는 밤하늘 별들도소중한 내 기억으로 사랑을 만들죠고백해 난 그대만을 사랑합니다 ,2009.03.12
정철,발라드,기억해 한 순간이라도미안해 널 울게 한 나그렇게 내 손에서떠나는 널 사랑한거야기억해 또 한번 너에게사랑을 약속했던 날그렇게 한 걸음더 다가간 그 순간나를 기억해내 맘에 가득내 안에 널 채워갈 때에간절한 그 손길이어느새 더 깊이 다가와늘 이유 없이 보고 싶어서잠 못 이룰 때언제나 그래왔듯너와 나처럼 영원까지떨어져 그리워한지난 그 사람보다이젠 내가 더 사랑할거야기억해 한 순간이라도미안해 널 울게 한 나그렇게 내 손에서떠나는 널 사랑한거야기억해 또 한번 너에게사랑을 약속했던 날그렇게 한 걸음 더 다가간그 순간 나를 기억해그저 다시 보는 그 길은내게 행복이란 걸눈 앞에 너라는 게꿈처럼 믿기지 않았던첨 만남처럼 설레었던 그 시간들이나에겐 너무나도바래왔던 내 마음인걸떨어져 그리워한 지난 그 사람보다이젠 내가 더 사랑할거야기억해 한 순간이라도미안해 널 울게 한 나그렇게 내 손에서떠나는 널 사랑한거야기억해 또 한번 너에게사랑을 약속했던 날그렇게 한 걸음 더다가간 그 순간 나를 기억해 ,2009.03.06
박상민,발라드,니가 그리운 날엔 니가 그리운 날엔함께한 기억을 가슴에 새긴다그립다는 말이 얼마나 아픈지널 잊고 살아가는게 얼마나 힘든지잊어야 하는데 지워야 하는데세상이 자꾸 힘들때 마다니가 준 기쁨이 니가 준 사랑이너무 미안해서 너무 미안해서눈물나게 고마운데니가 그리워서 오늘도니가 보고파서 오늘도가슴 한 가득 네가 차올라항상 기다리고 있잖아두 눈을 감아도 보여두 귀를 막아도 들려어떡해 니가 그리운 날엔니가 그리운 날엔 니가 그리운 날엔널 볼수있다면 얼마나 좋을까그리운 목소리 그리운 얼굴이내 가슴안에 가득차 얼마나 힘든지잊어야 하는데 지워야 하는데세상이 자꾸 힘들때마다니가 준 기쁨이 니가 준 사랑이너무 미안해서 너무 미안해서눈물나게 고마운데니가 그리워서 오늘도니가 보고파서 오늘도가슴 한 가득 네가 차올라항상 기다리고 있잖아두 눈을 감아도 보여두 귀를 막아도 들려어떡해 니가 그리운 날엔니가 그리워서 오늘도니가 보고파서 오늘도가슴 한 가득 네가 차올라항상 기다리고 있잖아두 눈을 감아도 보여두 귀를 막아도 들려어떡해 니가 그리운 날엔어떡해 니가 그리운 날엔 ,2009.02.24
"MC 한새, 원준희",발라드,슬픔은 잊을 수가 있지만상처는 지울수가지울 수 없는 그대그 기억 그 상처사랑은 언제나 내 맘속에그대로 내 가슴에 상처로 남겠지만그대여 기억해줘이토록 아픈 내 맘속에한편의 추억으로 남아있어내가 숨쉬고 있는 이 세상에서그대와 영원히함께 하고 싶었는데이별의 상처는 아물지 않고그대의 숨결만 남아난 느낄 수 있어슬픔은 잊을수가 있지만상처는 지울수가 없어요오랜 시간이 흘러도희미해질 뿐이예요사랑하는 그대여이것만은 기억해줘요그토록 사랑했던 내 영혼은지금 어두운 그림자 뿐임을그대여 이것만 기억해줘그토록 그대만을 사랑한 나라는 걸그대여 이것만 기억해줘이대로 깨져버린 유리처럼 아프단 걸그대여 이것만 기억해줘사랑은 우리들의 가슴속에 영원한 걸그대여 이것만 기억해줘어둠속에서도 그댈 찾을 수 있어꿈을 꾸고 있어 그대가 돌아오는이 꿈속에서그댄 내게 미소를 짓고 있어그대 품에 안겨눈물을 흘려봐도 눈물은차가운 이슬이 되어새벽을 맞이 하는 걸어떻게 지낼까어떻게 찾을까생각뿐인 내 삶은 어두운 그림자사랑해그대에게 해주고 싶은 마지막 한 마디사랑해 영원히슬픔은 잊을수가 있지만상처는 지울수가 없어요그대 꿈속에서그대 품에 안겨사랑해 이말밖엔슬픔은 잊을수가 있지만상처는 지울수가 없어요오랜 시간이 흘러도희미해질 뿐이예요사랑하는 그대여이것만은 기억해줘요그토록 사랑했던 내 영혼은지금 어두운 그림자 뿐임을지금 어두운 그림자 뿐임을 ,2009.02.25
이수영,발라드,난 네가 숨쉴때난 네가 걸을때난 네가 지쳐서 눈물 흘릴때도난 아무말없이 널 지켜봤지만끝내 너는 해낼꺼라고 믿었었지나는 항상 너를 사랑하네나는 항상 너를 축복하네어두웠던 이 밤이 지나면아무일도 없었다며 웃을테니난 네가 숨쉴때난 네가 걸을때난 네가 지쳐서 눈물 흘릴때도난 아무말없이 널 지켜봤지만끝네 너는 해낼꺼라고 믿었었지나는 항상 너를 사랑하네나는 항상 너를 축복하네어두웠던 이 밤이 지나면아무일도 없었다며우리들은 너를 사랑하네우리들은 너를 축복하네내일이면 내 두손 꼭잡고웃는 널 사랑하네영원히 ,2009.03.02
비,발라드,이별 앞에서 어느 누구도당당해질 수가 없겠죠나도 그립죠 마음 찢어지고이를 악물고 대답했죠헤어지자고 니 말대로 난 한다고나는 멋지게 이별의 말 뱉었죠나보다 좋은 사람을 찾아가라고겉으론 그렇게 말했죠난 울며 너를 기다려우리 함께했던 날추억 담긴 그침대 위에서 그대는방문을 열고 어김 없이 날 찾아오겠죠넌 내 인생의 전부니까기억하니 넌 9월 12일 그때를평생 잊을 수 없는 말을 했잖아서롤 믿으며 시작을 해보자던 말난 그때를 잊을 수 없어난 울며 너를 기다려그대 환한 웃음은난 아직도 표현하지 못했지만진심으로 난 나에게 그대 뿐이였었죠세상 하나 뿐인 나의 너돌아오라는 건 아니야 나는너는 진짜 행복해야 돼니가 나 때문에 흘린 눈물이내 가슴을 자꾸 저며와 행복해난 울며 용서를 빌어너를 힘들게 하는느끼겠니 나이제서야 바보같은 맘을 전하네듣고 있는 네게 다시 말을 해난 아직도 너의 남자야사랑했어 너의 모든 걸 ,2009.03.04
성진우,성인가요,어둡던 내삶에 찬란한 빛으로내게 다가와내생활을 확 바꿔 버렸어이리보고 저리봐도 내사랑한번보고 두번봐도 내사랑너에겐 내가 딱이야사랑이란게 이런거였나예전엔 몰랐었지널 만난 이후로 내 생활은행복의 연속이야너없인 못살아 못살아나에겐 너뿐이야딱이야 딱이야 내가 딱이야어둡던 내삶에 찬란한 빛으로내게 다가와내생활을 확 바꿔 버렸어이리보고 저리봐도 내사랑한번보고 두번봐도 내사랑너에겐 내가 딱이야어둡던 내삶에 찬란한 빛으로내게 다가와내생활을 확 바꿔 버렸어이리보고 저리봐도 내사랑한번보고 두번봐도 내사랑너에겐 내가 딱이야사랑이란게 이런거였나예전엔 몰랐었지널 만난 이후로 내생활은행복의 연속이야너없인 못살아 못살아나에겐 너뿐이야딱이야 딱이야 내가 딱이야어둡던 내삶에 찬란한 빛으로내게 다가와내생활을 확 바꿔 버렸어이리보고 저리봐도 내사랑한번보고 두번봐도 내사랑너에겐 내가 딱이야너에겐 내가 딱이야 ,2009.03.05
"BIGBANG, 2NE1",댄스,Lolli Lolli Oh Lollipop  Lolli Lolli Oh Lolli Lollipop  Lolli Lolli Lollipop Oh  넌 나의 Lollipop  Lolli Lolli Lollipop Oh  Lolli Pop Pop  Lolli Lolli Lollipop Boy  넌 나의 Lollipop  Lolli Lolli Lollipop Oh  Lolli Pop Pop  막대사탕보다 더 달콤한  내 마음은 터질듯한  Dynamite  난 깔끔한 남자 T O P  내사랑  Bling Bling like L E D  그댄 딱 내 스탈야  반짝반짝 스타야  색다른걸 원해  Let me show you if that's okay  Now come on 색깔은  Rainbow  날 느낀 순간 넌  빠져버린걸 알아  You just can't control  날 사로 잡은 건  너와 나만이 아는 우리 둘의  Secret light  Lolli Lolli Lollipop  달콤하게 다가와  Lolli Lolli Lollipop  내게 속삭여줘  Lolli Lolli Lollipop  상큼하게 다가와  Lolli Lolli Lollipop  너를 원하잖아  Lolli Lolli Lollipop Girl  넌 나의 Lollipop  Lolli Lolli Lollipop Oh  Lolli Pop Pop  날 설레게 하는  너의 Body 너의 Move  이미 네 시선을 가둬버린 나의  Groove 식상함들은  매일 날 지치게 해 Let's just keep You and I F R E S H Now come on 색깔은  Rainbow 날 느낀 순간 넌  빠져버린걸 알아 You just in control 날 사로 잡은 건 너와 나만이 아는 우리 둘의 Secret Light Lolli Lolli Lollipop 달콤하게 다가와 Lolli Lolli Lollipop 내게 속삭여줘 Lolli Lolli Lollipop 상큼하게 다가와 Lolli Lolli Lollipop 너를 원하잖아 Lolli Lolli Lollipop boy 넌 나의 Lollipop Lolli Lolli Lollipop Oh Lolli Pop Pop 한 순간의 느낌이 아냐 지금 두 눈을 감아도 넌 내 앞에 서있는걸 내가 바라던 그게 너야 그냥 이대로  너와 나 저 불빛아래 Lolli Lolli Lollipop 달콤하게 다가와 Lolli Lolli Lollipop 내게 속삭여줘 Lolli Lolli Lollipop 상큼하게 다가와 Lolli Lolli Lollipop 너를 원하잖아 Lolli Lolli Lollipop oh 넌 나의 Lollipop Lolli Lolli Lollipop Oh Lolli Pop Pop Lolli Lolli Lollipop oh 넌 나의 Lollipop Lolli Lolli Lollipop Oh Lolli Pop Pop ,2009.03.27
케이윌,발라드,눈물이 뚝뚝가네요점점 멀어지네요가네요점점 작아지네요가네요그댈 좀 더 보고 싶은데좀 더 기억하고 싶은데자꾸 번져가네요널 사랑해소리쳐서 불러보고 싶어사랑해웃으면서 보낼 수가 없어미안해뒤돌아 봐줄 수 없겠니사랑하니까하루라도 멀어질 수 없어내 맘을 알잖아제발 돌아봐줘요 제발아나요눈물 흘리는 날 아나요그냥 서있는 걸 아나요내 모습이 이래요널 사랑해소리쳐서 불러보고 싶어사랑해웃으면서 보낼 수가 없어미안해뒤돌아 봐줄 수 없겠니사랑하니까하루라도 멀어질 수 없어내 맘을 알잖아제발 돌아봐줘요 제발 다시 내게죽을 만큼 아픈 것 조차지금 나는 느낄 수도 없어오직 돌아보기만 바래기다릴게이 자리에 멈춘 채로 널 기다릴게한걸음도 움직이지 않고너만을 기억하고 또 기억할게사랑하니까한 순간도 잊지 않을 거야내 맘을 알잖아제발 돌아봐줘요제발 다시 내게,2009.03.31
지아,발라드,왜 몰랐을까항상 나를 위했던천사처럼 착했던 널왜 몰랐을까까다로웠던 나를말없이 다 받아준 널헤어지잔 말진심이 아니었는데뒤늦은 후회가 슬퍼고마운 줄 모르고너를 실망시켰던지난날의 내가 미워내 철없음을 용서해난 사랑을 잘 몰랐어널 잊으라고 하지마못난 심장이 매일 울어너 돌아오면 안 되니너 없으니까 죽을 것 같아이젠 알겠어내겐 너무 소중한 너야덜컥 겁이나이대로 널 잃을까봐두려워 조바심이 나받지 않는 전화를수십 번도 더 걸어내가 정말 미쳤나봐내 철없음을 용서해난 사랑을 잘 몰랐어널 잊으라고 하지마못난 심장이 매일 울어너 돌아오면 안 되니너 없으니까 죽을 것 같아이젠 알겠어내겐 너무 소중한 너야널 기다리고 있을게그 자리에 서 있을게널 힘들게 해 미안해내 잘못들도 모두 잊어나 정말 많이 울었어멍든 가슴이 터질 것 같아제발 돌아와우리 다신 헤어지지마너 없으니까못 보니까 죽을 것 같아 ,2009.04.02
에픽하이 (EPIK HIGH),랩/힙합,그대가 읊조리는시는 영원뒤로 맴도는 echo메마른 귀로 샘솟는숨소리는 음악사에 기록된그대가 읊조리는 시는영원뒤로 맴도는 echo메마른 귀로 샘솟는 숨소리는음악사에 기록된 모든 음표조각난 날 줍고 있어나는 Troubled이 Lie내 슬픈 초상화를 맞춰가는Puzzle이야내 맘은 썩은 지하줏대가 뒤엉킨 이Mix오직나란 감옥속에 갖힌 Convict구속복의 몸짓 다들 비웃었지Oh So Sick 속이 꼬여Like 뫼비우스의 띠나는 귀를 귀울였지내면에 언제나 외면했던Me My Self And I 삼자 대면에거짓된 선악에 고여무너지고 드러난세상의 천성 안에 꼬여I Was Blind현실 갸륵한 두눈이 나를 속여제 3의 눈을 뜨니까선명하게 보여넌 나의 영감 영원 And 영혼Without youI got no reason to go on너란 숨을 쉬며 살아가 애벌레 혼이나비로 피어 날아가 Epik HighNo reason to live Without youNo reason to live Without youNo reason to live Without youNo reason to live Without you그대는 나의 하늘 같아그안에 난 태양을 봤다짙은 밤에 살다 밝은 빛을 받아이제는 맘에 풍요로운 밭을 간다봄을 알리던 입맞춤겨울이 보내긴 싫어 긴 한숨쉬지만 지구의 양극처럼서로 밀고 당겨 붙었어 남북처럼애초부터 하나에서 둘은 아닌 조각그대와 나 우리둘만 나눠가진 고막그안에 울린 사랑 사랑 사랑 사랑운명같은 만남 만남 만남 만남아름다운 칼이라 해도난 그대를 잡으리바람같은 맘이라  해도난 그대를 따르리그누구도 살수 없는지옥같은 밤이라 해도난 빛을 놓고 편히 눈을 감으리No reason to live Without youNo reason to live Without youNo reason to live Without youNo reason to live Without you그대는 감옥같은내인생의 밝은 창빠지면 헤어날 수 없어바다 같은 강무력한 두발 숨기며 잠기겠어그대가 원한다면영혼 마저 바치겠어Without You 내맘은 텅비겠어한없이 야속해 맘 어떻게이 세상을 견디겠어한순간에 못가 미친다피내리는 4월아모든게 파멸 할 때까지 너를 지킨다L O V E YouI was made to be with youmade to be with youmade to be with youL O V E YouI was made to be with youmade to be with youmade to be with youL O V E YouI was made to be with youmade to be with youmade to be with youL O V E YouI was made to be with youmade to be with youmade to be with youL O V E YouI was made to be with youmade to be with youmade to be with you ,2009.03.27
애프터스쿨,댄스,I love my boyWoo yeahI love my boyI love you ma boyI love my boydo do ro doro doroI love my boyI love you ma boyEverybody scream오늘밤 매일밤 자꾸만 네 생각만나는 그대의 Diva di di diva오늘밤 매일밤 짜릿짜릿한 이 순간나는 그대의 Diva di di diva자꾸만 네 생각이 나너의 달콤한 향기아무렇지 않은 척난 네게 빠져버렸어차갑게 말을 한대도나는 멈출 수 없어날 바라본다고 약속해 내게I got 니 맘을 열 수 있는Master key넌 나의 Masterpiece둘이 같이 마치 환상의 Tag teamYou know we are destiny사랑은 불 타 After this너무나 달콤한 속삭임짜릿짜릿한 Kiss so sweetBoy U're my favorite오늘밤 매일밤 자꾸만 네 생각만나는 그대의 Diva di di diva오늘밤 매일밤 짜릿짜릿한 이 순간나는 그대의 Diva di di divajust tell me what you wanna do내 맘을 가져가라고I don't wanna let you go넌 나만 바라보라고I just wanna get it done사랑을 말 할 거라고아파도 좋아네가 없이는살 수가 없는데 난I got big plan 4 U luv 4 UI don't give a damn what people say우리 사랑이 중요해No matter what U're ma man자꾸만 점점 난 번져L O V E 사랑이란 감정U're so perfect 넌 내게 만점Come 2 me 내게 다가와줘오늘밤 매일밤 자꾸만 네 생각만나는 그대의 Diva di di diva오늘밤 매일밤 짜릿짜릿한 이 순간나는 그대의 Diva di di diva오늘밤 네 곁에서 잠들고만 싶어이런게 사랑일까 자꾸만 떨려따뜻한 너의 품에 안기고만 싶어나 이제 어떡해 너에게 빠졌나봐오늘밤 매일밤 자꾸만 네 생각만나는 그대의 Diva di di diva오늘밤 매일밤 짜릿짜릿한 이 순간나는 그대의 Diva di di diva오늘밤 매일밤 자꾸만 네 생각만나는 그대의 Diva di di diva오늘밤 매일밤 짜릿짜릿한 이 순간나는 그대의 Diva di di diva나나나나나나 나나나나나나나나나나나 나나나나나Diva di di diva,2009.04.09
