artist,genre,lyric,date
"아웃사이더, MC 스나이퍼",발라드,수줍어서 말 못했나내가 싫어 말 안 했나지금도 난 알 수 없어요이 노래를 듣는다면나에게로 와주오그대여 난 기다립니다니가 나를 떠나이건 신의 장난이젠 누굴 믿나떠나지마 너무짧은 만남그대를 난 어찌잊나 별이 지던밤숱한 눌물로써 했던 약속그댄 잊었나방황을 먹고자란 방랑자 같은 삶은바다를 유랑하는 파도와도 같아내 성격 알잖아 속이 타 죽는다한번을 살더라도 나는 너랑 살아그러니 돌아와가랑비에 옷이 젖듯변해버린 사랑은 회복이 가능그간 너의 집 앞골목길에 남긴 발자국은천국을 향해 걷던 천사들의 선물한결같았던 그대의 숨결물결이 치는듯한 그대의 머릿결이 노래가 들린다면 내게 와주오그대가 없는 삶은 난 어찌 사노수줍어서 말 못했나내가 싫어 말 안 했나지금도 난 알 수 없어요이 노래를 듣는다면나에게로 와주오그대여 난 기다립니다그래 넌 알고있을까나혼자 애태우던 밤아직 그대로일까작은 골목 그대 집앞깍지낀 두손 놓기 매일 아쉬워빨리 내일이 오길 잠들던 굼뜨던매일이 들떠 숨죽여내 어깨 잠든 그댈보며만약 이대로시간이 혹시 멈추더라도we got it going onlove goes on and onlove & trust belive우리 함께 듣던luve sic ptar 3영원할 거라던약속은 시간속 추억에 작은 조각약속은 시간속 추억에 작은 조각한 여름 밤에 꿈이젠 기약없는 그품그날의 나의 너에게 꼭 말해주고픈아직도 난 사랑합니다수줍어서 말 못했나내가 싫어 말 안 했나지금도 난 알 수 없어요이 노래를 듣는다면나에게로 와주오그대여 난 기다립니다떠나간 나의 님아 떠나간 나의 사랑아떠나간 나의 사람아떠나간 나의 삶의 모든 것들아 안녕우리 다시 만나는 그날이 오면잠시 걸음을 멈춰우리가 함께 나눈 추억들을 회상하자순간은 아주 잠깐 추억은 영원할까돌이킬 수 없는 그날을그 누가 과연 알아줄까넌 아마도 모를거야넌 아마도 좀 더 커야인생의 참맛을 느낄거야나중에 보면 웃길거야 아마날 떠나간 벗도 사랑도모두다 너무나 소중한보물상자 그 상자를 펼쳐 그리고 멀리저 멀리 훨훨 날아갈 수 있도록날개를 펼쳐 높이저 높은 곳으로 힘껏 던져희망을 건져 추억이 붉게 번져부끄럽지만낯간지러운 기억들이 생생해난 아직 쌩쌩해눈앞이 아른아른거리네우리가 함께 걷던 거리의 모습은그대로 변한 것 없는데우린 왜 변했을까난 아직도 그날을 추억해수줍어서 말 못했나내가 싫어 말 안 했나지금도 난 알 수 없어요이 노래를 듣는다면나에게로 와주오그대여 난 기다립니다아직도 난 사랑합니다 ,2010.08.27
나몰라패밀리 (Namolla Family),댄스,we do We like yeahDo we like yeahDo we like yeahDo we like yeahDo we like yeahDo we like yeahOh One more chanceGive me one moreGive me one moreGive me one moreGive me one more왜 내 맘을 왜 몰라줘Give me one moreGive me one moreGive me one moreGive me one more왜 내 사랑 왜 몰라줘널 향한 내 사랑 왜 넌 몰라뭘 그리도 내 사랑에 놀라오늘밤은 너와나 둘이서로의 끌리는 맘들이자신을 가지고 Step by Step오늘밤을 기다렸던 나N N N N N N N N NowDon't be shy 내가 다가갈께그렇게 자신이 없니니가 자꾸만 또 튕기잖아좀 더 자신있게 말해니가 너무 까칠한 걸 몰라까칠한게 아냐 정말내가 어떻게 생각해야 되사실 나 조금씩 끌려그럼 내 맘을 받아줘오늘밤에 했던 말 했던 말 왜 몰라오늘밤에 했던 말 했던 말 넌 몰라오늘밤에 했던 말 왜 몰라 나몰라이렇게 아픈데도 넌 몰라 넌 몰라 왜Give me one moreGive me one moreGive me one moreGive me one more왜 내 맘을 왜 몰라줘Give me one moreGive me one moreGive me one moreGive me one more왜 내 사랑 왜 몰라줘Oh Oh to the leftOh Oh to the right니가 투덜대도너만 바라보는 난 화목해Give me o n e m o r e왜 내 맘을 왜 몰라줘Give me o n e m o r e왜 내 사랑 왜 몰라줘N N N N N N N N Now이젠 내가 네게 다가갈께N N N N N N N N NowShow me what you got my sweety어딜보고 있는거니눈 앞에 네가 진짜 안보여안보여 보이지 않아이러는 내가 보이긴 하니넌 너무 쉽게 생각해표현이 많이 서툴러 그래사랑은 표현인거야이젠 내 맘을 알아줘오늘밤에 했던 말 했던 말 왜 몰라오늘밤에 했던 말 했던 말 넌 몰라오늘밤에 했던 말 왜 몰라 나몰라이렇게 아픈데도 넌 몰라 넌 몰라 왜넌 내겐 너무 가혹한 걸도도한 표정 차가운 걸조심스레 다가가기도 내겐 너무 벅차OK 이번이 마지막 Chance지금 필요한 건 바로 SenseI don't wanna missthis I just wanna kiss you오늘밤에 했던 말 했던 말 왜 몰라오늘밤에 했던 말 했던 말 넌 몰라오늘밤에 했던 말 왜 몰라 나몰라이렇게 아픈데도 넌 몰라 넌 몰라 왜Give me one moreGive me one moreGive me one moreGive me one more왜 내 맘을 왜 몰라줘Give me one moreGive me one moreGive me one moreGive me one more왜 내 사랑 왜 몰라줘 ,2010.08.31
가인,댄스,떠나려는 너의 다릴 붙들고 나를 밀어내는 네 팔에 매달린 채 더는 이러지도 못해 저러지도 못해 나를 욕보이고 더럽혀질 빈 곳도 안 남은 내 몸엔 나쁜 피만 흐르는 그저 짧은 한 숨 가볍게도 가는 너의 한 걸음 kill me or love me 둘 중에 하나 지치고 지쳐도 또 다시 빌어도 넌 또 나를 밀쳐 또 1초 2초 3초 4초 이럴바에 난 죽을래 lie don't lie don't lie 다 새빨간 거짓말로 들리는 난 벼랑 끝에 몰리는 lie don't lie don't lie 이 스토리엔 좋은 끝이란 없어 널 놓고 말고란 없어 째깍째깍 달리는 저 바늘 끝은 내 맘을 또 찌른다 날 울린다 왜 날 이렇게 만들어 왜 돌이킬 수 없게 만들어 네가 하는 말 다 lie and lie 기어이 난 너를 잡고 버티고 나를 파고드는 상처마저 모른 채 더는 망가질 수 조차 부서질 수 조차 없이 무너지고 까맣게 탄 눈물만 흐르네 칼이 되어 내 귀에 박히는 너의 짧은 한 숨 그리고 또 독이 걸린 한 걸음 kill me or love me 선택은 하나 울고 소리치고 빌고 애원해도 넌 또 걸음을 뗐고 1초 2초 3초 4초 네 안에서 난 죽을래 lie don't lie don't lie 다 새빨간 거짓말로 들리는 난 벼랑 끝에 몰리는 lie don't lie don't lie 이 스토리엔 좋은 끝이란 없어 널 놓고 말고란 없어 째깍째깍 달리는 저 바늘 끝은 내 맘을 또 찌른다 날 울린다 왜 날 이렇게 만들어 왜 돌이킬 수 없게 만들어 네가 하는 말 다 lie and lie 모르셨구나 보기보다 나 머리 나쁜데 째깍째깍 시간은 또 흘러 흘러 내 맘을 또 흔든다 날 흔든다 끝으로 달린 니 말이 날 여기까지 오게 만들어 내게 하는 말 다lie and lie,2010.10.08
임정희,발라드,이게 진짜일 리 없어주변을 지나던 사람들하나 둘씩 느려지고주위의 모든 게갑자기 들리지가 않아세상은 갑자기 멈춰진흑백사진 같은데니 목소리만 메아리처럼 헤어지자이게 진짜일 리 없어니가 날 떠나는 게꿈속인 게 틀림 없어눈물도 나지 않는 게누가 나 좀 꼬집어 줬으면 해꿈이라면 나를 깨워줬음 해아님 내가 살 수 없어이게 진짜일 리 없어 그건 안돼조금씩 주변의 사람들움직이기 시작했고니가 일어서는 모습이영화처럼 보여떠나는 널 잡아보려고손을 내밀려 해도온몸이 돌처럼다 굳어버린 것 같아이게 진짜일 리 없어니가 날 떠나는 게꿈속인 게 틀림 없어눈물도 나지 않는 게누가 나 좀 꼬집어 줬으면 해꿈이라면 나를 깨워줬음 해아님 내가 살 수 없어이게 진짜일 리 없어니가 떠나고 나서야머리가 움직이나 봐그대 뒤를 쫓아거리를 헤매어 뛰지만이게 진짜일 리 없어니가 날 떠나는 게꿈속인 게 틀림 없어눈물도 나지 않는 게누가 나 좀 꼬집어 줬으면 해꿈이라면 나를 깨워줬음 해아님 내가 살 수 없어이게 진짜일 리 없어이게 진짜일 리 없어정말 니가 떠났나 봐 ,2010.09.30
SHINee (샤이니),댄스,이럴 때를 보면나 어리기는 한가봐눈 앞에 두고도 어찌 할 줄 몰라어떻게들 사랑을 시작하고 있는지사랑하는 사람들 말해줘요언젠가 그녀 손을 잡아 볼 날 올까요감은 두 눈 위에Kiss하는 날도 와줄까요Hello Hello나름대로 용길 냈어요Hello Hello잠시얘기 할래요Hello Hello내가 좀 서툴진 몰라도Who knows 어쩜 우린 잘 될지도 몰라내가 다가서야 하는지좀 더 기다려야 하는지모두 다른 말을 하는 게 더 어려워믿을 수 없겠죠보기보다 눈이 높아요이런 일 난 흔치 않아요내 말 믿어줘요 yeah아무렇지 않게 그녈 안을 날 올까요생각한 대로 모두 이뤄진단 말 믿어요Hello Hello나름대로 용길 냈어요Hello Hello잠시얘기 할래요Hello Hello내가 좀 서툴진 몰라도Who knows 어쩜 우린 oh yeah처음은 아니죠 사실 말하자면사랑도 이별도 해봤죠하지만 어려워요이 말을 믿어줘요그대는 달라요Hello Hello이번엔 나를 다 걸게요Hello HelloOoh yeah Baby Baby Baby girlHello Hello 지금은 어떨지 몰라도Who knows 어쩜 우린Hello 내 곁을 맴돈그 시간들을 계속그 어떤 기쁨과도 비교 못해No More 그댈 이젠 표현 할수 없고내 손을 잡는다면Never let you go이런게 사랑이면 절대 안놓쳐Who knows 우리 둘이운명일지 몰라Hello Hello ,2010.09.30
다비치,발라드,"이제야 그댈 보내주네요",2010.10.08
2PM,댄스,I'll be back넌 다시 나를 찾을 거야그때 다시 내가 올 거야그 누구도 너를나보다 사랑 할 순 없기에갑자기 이럼 어떡해난 어떻게 하란 말야네가 도대체 어떻게 이래난 네가 날 영원히 사랑할거란 말믿었단 말야약속했잖아 영원히 변하지 말자고우리는 분명 맺어진 짝이라고분명히 맞다고네가 그렇게 얘기했잖아I'll be back넌 다시 나를 찾을 거야그때 다시 내가 올 거야그 누구도 너를나보다 사랑 할 순 없기에You'll be back너는 다시 돌아 올 거야그래서 널 보내는 거야나는 알아 네가 나 없인 못산단 것을I'll be back넌 난 우린 헤어질 수가 없어네가 착각을 하나 봐이건 누구나 한번쯤 겪는고비일 뿐이야 정신차려다시 생각해아무리 말을 해 줘봐도 이미 넌말을 듣지 않아메아리로 돌아오잖아I'll be back넌 다시 나를 찾을 거야그때 다시 내가 올 거야그 누구도 너를나보다 사랑 할 순 없기에You'll be back너는 다시 돌아 올 거야그래서 널 보내는 거야나는 알아 네가 나 없인 못산단 것을Listen baby girl그래 돌아서줄게멋지게 남자답게 놓아줄게그리고 널 귀찮게 하지 않게말없이 저 뒤에서죽은 듯이 서서 바라볼게너는 모르게 그냥 멀리서아주 많이 떨어져서나의 존재를 네가 완전히 잊어버리게But you better know thatI'm not giving you awayWill I ever stop waiting no wayIt'll be the same in my worldI'm your boy You're my Girl잠깐 그댈 보내지만난 네가 다시 돌아올 거란걸 알아그러니 걱정 말아 네가 쓰러질 때I'll be backI'll be back넌 다시 나를 찾을 거야그때 다시 내가 올 거야그 누구도 너를나보다 사랑 할 순 없기에You'll be back너는 다시 돌아 올 거야그래서 널 보내는 거야나는 알아 네가 나 없인 못산단 것을I'll be back ,2010.10.11
남녀공학,댄스, late 다시한번 말해 It's too late 내앞에서 꺼져 잔소린 집어쳐 왜 자꾸만 다그쳐내가 뭘 잘못했어? 어어 어어 어어어?잔머리 집어쳐 왜 자꾸 뒷 걸음쳐한눈판거 다알어? 어어 어어 어어어? *Too late 너무 늦어 버렸어 Too late 아직 늦지 않았어Too late 내앞에서 사라져 Right now Right now Right now **머리부터 발끝까지 하나부터 열까지 다 거짓말넌 아직 남잘몰라머리부터 발끝까지 하나부터 열까지 다 거짓말두번다신 날 찾지마 It's too late 다시 한번 말해 It's too late 내앞에서 꺼져It's too late 다시 사랑 할래 It's too late 한번만 더 기회를줘 뭐라고 욕해도 할말은 없어그녀와 있던건 사실이었어 Break your mind가슴이 미친듯 뛰고있어날카로운 말이 싫어 위태로운 내가 싫어짜증만 내는 니 모습이 날 또 할 말 없게 만들어 더얘기해봤자 제자리만 멤돌아내속만 타들어가 어어 어어 어어어바람을펴봤자 내 손바닥 안이야도대체 몇번째야? 어어 어어 어어어? *Too late 너무 늦어 버렸어 Too late 아직 늦지 않았어Too late 내앞에서 사라져 Right now Right now Right now **머리부터 발끝까지 하나부터 열까지 다 거짓말넌 아직 남잘몰라머리부터 발끝까지 하나부터 열까지 다 거짓말두번다신 날 찾지마 속아주는척 딱 한번 내게 기회를줘아직까진 널 사랑하니까 믿어볼래 와와와 와줘 와와 What's gonna Back to me가슴이 미친듯 소리질러와와와 와줘 와와 What's gonna Come to me내가 미쳐 버릴것같어 **머리부터 발끝까지 하나부터 열까지 다 거짓말넌 아직 남잘몰라머리부터 발끝까지 하나부터 열까지 다 거짓말두번다신 날 찾지마 머리부터 발끝까지 너 때문에 내가슴 다 망가져한번만 날 용서해머리부터 발끝까지 너 때문에 내가슴 다 망가져두번 다시 용서못해,2010.09.30
보아 (BoA),댄스,설레임이 날 지배해어지러운 머리 속 헤집고 들어와소녀가 왕자님을 만나듯하 꿈같은 스토리지번쩍이는 저 뜨거운 flash light모두 내게 목말라 손을 내밀 때지나치지 못하고 니 눈빛에 잡힌 나hello Mr Perfect 나를 만난거야이제부터 진짜 Super Star로 변신해흐르는 핏속에 스며드는 멜로디완벽한 너로 다시 태어나게B O A D N A 이유있는 자부심it's all right yeah That's right꿈꾸던 그 fantasy새롭게 빛나는저 파란 별이 되는 법내가 가진 모든 것 너에게만다 copy & paste보고 듣고 다 안다고 믿지마먼저 일어난 새는 조금 외로운걸영화보다 더한 사건들도매일 진짜로 일어나내 주위 친구들보다 먼저어른이 되야 하지만누구보다 어린걸 나중에야 알게 돼믿지 우리는 MATCH 이끌림 그 이유마치 Puzzle처럼 완벽히 딱 맞을 걸기쁨도 슬픔도 이 리듬처럼 말야넌 또 하나의 나 막지못해B O A D N A 너로인한 자부심다 copy 날 copy 사랑이란 메세지언제나 조금 더따뜻하게 바라봐준 너내가 가진 모든것 너에게만다 copy & paste그렇게 믿고 있었지온 우주가 날 따라 돈다고이제부터 그대가 나의태양이 되어 주겠니너를 따라 돌테니나를 비춰 주겠니B O A D N A 이유있는 자부심it's all right yeah That's right꿈꾸던 그 fantasy새롭게 빛나는저 파란 별이 되는 법내가 가진 모든것 너에게만다 copy & paste다 copy & paste ,2010.09.24
김범수,발라드,"감기가 언젠간 낫듯이 열이나면 언젠간 식듯이 감기처럼 춥고 열이나는 내가 언젠간 날거라 믿는다추운겨울이 지나가듯 장맛비도 항상 끝이 있듯 내 가슴에 부는 추운 비바람도 언젠간 끝날 걸 믿는다얼마나 아프고 아파야 끝이 날까얼마나 힘들고 얼마나 울어야 내가 다시 웃을 수 있을까지나간다 이 고통은 분명히 끝이 난다내 자신을 달래며 하루하루 버티며 꿈꾼다 이 이별의 끝을영원할 것 같던 사랑이 이렇게 갑자기 끝났듯이 영원할 것 같은 이 짙은 어둠도 언젠간 그렇게 끝난다얼마나 아프고 아파야 끝이 날까 얼마나 힘들고 얼마나 울어야 내가 다시 웃을 수 있을까지나간다 이 고통은 분명히 끝이 난다 내 자신을 달래며 하루하루 버티며 꿈꾼다 이 이별의 끝을그 믿음이 없인 버틸 수 없어 그 희망이 없었으면 난 벌써 쓰러졌을 거야 무너졌을꺼야 그 희망 하나로 난 버틴거야지나간다 이 고통은 분명히 끝이 난다 내 자신을 달래며 하루하루 버티며 꿈꾼다 이 이별의 끝을이 이별의 끝을
				",2010.09.29
서영은,발라드,사랑하고 있나 봐요 자꾸 열이 나온통 햇살이 내게만 비추는 듯해사랑하고 있나 봐요 자꾸 눈물 나빗물이 내게만 쏟아 지나봐그대를 처음 본 그 순간 난 느꼈어이 사람은 절대 놓치면 안돼오랜 시간 기다려왔던 사람따뜻한 5월의 햇살 같은포근함을 머금은 그대라는 사람은일생 동안 한 번 뿐인 나의 인연일까평생 동안 함께 걸어갈 내 사람일까그럴지도 몰라 이 찌릿찌릿한 느낌내 흐릿흐릿한 기억 속에설레었던 느낌 사랑인가봐사랑하고 있나 봐요 자꾸 열이 나온통 햇살이 내게만 비추는 듯해사랑하고 있나 봐요 자꾸 눈물 나빗물이 내게만 쏟아 지나봐all I need is loveall I need is love따사로운 봄날처럼내 맘 녹인 사람믿을 수가 없었지영화 같은 일이 내게도이제는 혼자서 주말을보낼 필요 없게 됐어다음 달쯤 예쁜 커플링도 낄 거야내게 약속해 줘요조금은 두렵기도 하지만사랑을 믿을게내게 고백해 줘요 oh oh어제보다 많이 오늘보다 많이그대를 사랑해사랑하고 있나 봐요 자꾸 열이 나온통 햇살이 내게만 비추는 듯해사랑하고 있나 봐요 자꾸 눈물 나빗물이 내게만 쏟아 지나봐누구도 모르게 나 혼자만그 미소 숨겨두고 싶어사랑하고 있나 봐요 자꾸 떠올라하얀 구름을 맨발로 걷는 것 같아사랑하고 있나 봐요 자꾸 겁이 나투명한 행복이 깨어질까봐all I need is loveall I need is love따사로운 봄날처럼 내맘 녹인 사람오직 그대 ,2010.09.28
싸이 (PSY),랩/힙합,당신은 너무나 섹시해쳐다 보지마 창피해 나풀거리는 단발머리의향기에 난 취해 가시 돋힌 장미같이앙칼져 보이는 아가씨 피부는 우유빛이고하늘거리는 옷은 비치고 미치고 이건 운명의 장난질이고내 Feel이고 어쩜 이리도 아름답냐너 사람 맞냐 보일듯 말듯 잡힐듯 말듯 아침 이슬 먹은 사슴의눈망울처럼 아주 촉촉해 내 눈에는 그대가 천사로 보여 내 눈에는 기쁨의 눈물이 고여 내 눈에는 모든게 아름다워요 내 눈에는 너 밖에 안보여향기로운 몸짓에 신비로운 눈빛에 간지러운 손짓에 너의 웃음소리에 너의 목소리에너의 콧소리에 난 반해버렸네 향수를 쓰지 않아 샴푸 냄새 하나 양주를 먹지 않아 감수성그 하나로 넌 독특해 난 어떡해 보면 볼수록 불 붙네 기름을 들이 붙네불 타올라 달아올라 도레미파솔라 도도해 보여 똑똑해 보여 무뚝뚝해 보여 하지만 화끈해 보여 몹시 맵시 나고 섹시한 아가씨보일듯 말듯 잡힐듯 말듯 아침 이슬 먹은 사슴의눈망울처럼 아주 촉촉해 내 눈에는 그대가 천사로 보여 내 눈에는 기쁨의 눈물이 고여 내 눈에는 모든게 아름다워요 내 눈에는 너 밖에 안보여향기로운 몸짓에 신비로운 눈빛에 간지러운 손짓에 너의 웃음소리에 너의 목소리에너의 콧소리에 난 반해버렸네 당신에게 홀딱 반해 빛이 난다네 너에 대한 환상에 환장해너무 이쁘잖아너 나랑 장난해당신에게 홀딱 반해 빛이 난다네너에 대한 환상에 환장해 이제 이리 와서 내게 장난해내 눈에는 그대가 천사로 보여 내 눈에는 기쁨의 눈물이 고여 내 눈에는 모든게 아름다워요 내 눈에는 너 밖에 안보여 워,2010.10.11
강승윤,발라드,언제나 난 혼자였었죠안에서도 밖에서도 혼자였죠외로움에 홀로 울기도하고짜증만 부렸어요 바보같이미안해요 미안해요말은 못했었지만 미안해요이제 마음을 담아 말 할게요당신이 주신 많은 선물을당신이 주신 넓은 사랑을미안하단 이작은 한마디도 하지못했던나를 이젠 용서해주세요사랑해요 사랑해요표현이 서툴러서 사랑해요하지못했던 그말 소리높여당신이 주신 많은 선물을당신이 주신 넓은 사랑을사랑한단 한마디 말조차도하지못했던 나를이젠 용서해주세요내가 외로울 때면언제나 나의 힘이 되주시는 내 어머니당신이 주신 많은 선물을당신이 주신 넓은 사랑을어떻게 해야할진 모르지만그래도 나 노력할게요정말 사랑해요 ,2010.10.04
화요비,발라드,"매력 있다는 말 참 괜찮다는 말",2010.10.14
마이티 마우스,발라드,"사랑이란",2010.10.14
씨야,발라드,정말 날 사랑하나요그래요 그거면 돼요너무 많은 걸 바래서마음이 아팠나 봐요슬픔이 우릴 찾아도나를 떠나면 안돼요이미 시작된 사랑을어떻게 보내야 하는지나는 잘 모르니까요이별이 오지 못하게하늘에 기도할까요서로만 사랑하도록 이대로만어디도 가지 못하게깊숙이 숨겨둘까요우리 사랑이대로만세상에 모든 사람과 세상에 모든 사랑절대로 다시는 이별이 오지 못하게세상에 모든 사람과 세상에 모든 사랑절대로 다시는 이별이 오지 못하게그대를 만나기 전에난 어디에 있었는지그대 만났던 그날난 다시 태어났던 거죠그대밖에 난 몰라요이별이 오지 못하게하늘에 기도할까요서로만 사랑하도록 이대로만어디도 가지 못하게깊숙이 숨겨둘까요우리 사랑이별이 오지 못하게다시는 너를 찾지 못하게내 모든걸 걸어서라도지금 네 곁을 난 지킬께이별아 우리 사랑만은못본척 그냥 지나가줘날 사랑해줘 나를 제발나를 떠나가지 말아줘눈가려도 보이니까그대만 보면 되니까두 눈을 감고 살까요 그럴 까요그댄 잊으면 안되요그대만 있으면 돼요그러면 나행복해요 ,2010.10.08
이적,록/메탈,솔직히 겁이 나요사실이 그래요앞길은 한치 앞도 모르니그대도 그런가요 마찬가진가요떨고있는 내가 우습지는 않나요그대랑 함께 갈래요꼭 끌어안고 갈래요서로에게 서로라면더할 나위가 없어요오싹한 낭떠러지도뜨거운 불구덩이도상관없어요 두렵지 않아요이제 내 손 잡아줘요아무런 말도 필요없고어느 누구도 말릴 수 없어요그대랑 하나되어 간다면우리가 우리가 되어 간다면그럼 충분해요어깨동무하고 팔짱을 엮고서떨려오는 마음을 가라앉히고서그대랑 함께 갈래요꼭 끌어안고 갈래요서로에게 서로라면더할 나위가 없어요오싹한 낭떠러지도뜨거운 불구덩이도상관없어요 두렵지 않아요이제 내 손 잡아줘요아무런 말도 필요없고어느 누구도 말릴 수 없어요그대랑 하나되어 간다면우리가 우리가 되어 간다면그럼 충분해요허풍이 될지도 몰라요흔들릴 수도 있겠죠그만큼 둘이서 되새기기로 해요지금의 마음을 처음에 있던 설렘아무런 말도 필요없고어느 누구도 말릴 수 없어요그대랑 하나되어 간다면우리가 우리가 되어 간다면그럼 충분해요 ,2010.09.30
"씨야, 다비치",발라드,첫번째 이별은 내가 너무 어려서창피한 줄도 모르고 펑펑 울었어하나 둘 사랑을 겪고나이도 먹어 가면서더는 울지 말자고 아파하지 말자고아무리 결심해도 그게 안돼이제 다 컸잖아 어른이 됐잖아철이 없는 거야 뭐야왜 자꾸만 우는 거야이제는 더 이상남자때문에 울지 않겠다고 결심했는데그것도 못 지켜 우는 내가 미워사랑을 시작하면 이별을 예정하고이번엔 울지 않겠지 멋진척해도어느새 흐르는 눈물나를 바보로 만들고더는 울지 말자고 아무리 다짐해도이별 앞에 왜 또 난 눈물이 나이제 다 컸잖아 어른이 됐잖아철이 없는 거야 뭐야왜 자꾸만 우는 거야이제는 더 이상남자때문에 울지 않겠다고 결심했는데그것도 못 지켜 우는 내가 미워울지않을래 울기가 싫어싫다는데 왜 자꾸 흘러어른이 되면 자꾸 사랑을 하면눈물 따윈 마를 줄 알았는데이제 다 컸잖아 어른이 됐잖아철이 없는 거야 뭐야왜 자꾸만 우는 거야이제는 더 이상남자때문에 울지 않겠다고 결심했는데그것도 못 지켜 우는 내가 미워,2010.10.11
