artist,genre,lyric,date
김장훈,"발라드, 국내드라마",버리고 싶은 건 니가 아니었어버려지는 건 내가 되어줄께이렇게 그냥 버려 둬 오지마차마 할 수 없는 그 말들 때문에더 힘들지도 몰라 더 묻지마아무것도 하지마 눈 뜨고 있으면여전히 우린 다시 살아갈거야니가 매일 다니는 골목 그 곳만그대로 있어 주면 돼니 생각밖에 할 줄 모르는 날 위해 울지는 마버리고 싶은 건 니가 아니었어버려지는 건 내가 되어 줄께이렇게 그냥 버려 둬 오지마니가 매일 다니는 골목 그 곳만그대로 있어주면 돼니 생각밖엔 할 줄 모르는날 위해 울지는 마이제는 심한 말로 날 아프게 한대도 좋아너를 더 많이 웃게 해주지 못한 나를 용서해 줘니가 매일 다니는 골목 그 곳만그대로 있어주면 돼니 생각밖엔 할 줄 모르는 날 위해제발 울지는 마 울지는 마,2004.09.30
Celtic Frost,록/메탈,"Once Prayed To My Gods . Searching For The Whistled Memories . Empty Eyes Are Staring Now . To My Feet A Land Of Sorrow . I'm The King . Sitting In The Dark . Hiding From The Shadows Of The Wind . Wafts Of Might . Wine Of Fire . I Was Called To Taste . Silver Horses Brought Us Here . To The Edge Of The Universe . We Left The Falling Walls . As The Stars' Collapse Began . Now I Rest On The Highest Steps . Revealed The Eternal Frontier . As I Gaze From The Jewel Throne . To The Portal Of Infinity . Fallen Have The ""Chosen Ones"" . Debris Remains In The Dust . Far Behind . Beyond The Sands . The Wind Sings To Those Who Fell . Forever Now . My Hands Lay Down The Poisoned Weapons . I Will Pray To My Gods . Searching For The Mysteries",2004.07.20
바다 (BADA),댄스,"그래 매일 같은 시선속에 나를 가둔 잣대뿐이야 아무 의미 없이 의무감에 넌 지쳐가도 괜찮니 순수했던 너에 표정 너무 지친 상처들로 가득해 oh no~ alright 모두 놀란 듯 그래 네 곁을 떠날지도 몰라 하지만 멈추지마 그것 역시 잠시일 뿐 너무 뻔한 일들에 무너지고 익숙했었던 너를 버려 약해지면 안돼 우린 다른 의미를 원하잖아 Tell me baby 때론 가치있는 이대로 모두 함께 make up one's mind Why don't you baby 작은 두 손을 들어 baby 나는 느꼈어 그 낯선 빛과도 만날 수 있는 강한 용기를 놓칠 순 없어 내 안에 너를 Oh how I feel oh my life 다 버리겠어 내게 소중한 그 어떤거라도 거울 속에 어제에 내 모습은 없을꺼야 oh 너도 알고 있잖아 나를 변하게 한 이유 너의 눈 속에 내 미래 우린 다른 의미를 원하잖아 tell me baby 너의 두 눈 속에 모두 함께 make up one's mind Why don't you baby 자유들이 너를 부르니까 나는 느꼈어 그 낯선 빛과도 만날 수 있는 강한 용기를 놓칠 순 없어 내 안에 너를 Oh how I feel my life 나는 느꼈어 그 낯선 빛과도 만날 수 있는 강한 용기를 놓칠 순 없어 내 안에 너를 Oh how I feel oh my life Oh 나는 느꼈어 그 낯선 빛과도 만날 수 있는 강한 용기를 놓칠 순 없어 내 안에 너를 oh~ oh~ 나는 느꼈어 그 낯선 빛과도 만날 수 있는 강한 용기를 놓칠 순 없어 내 안에 너를 Oh how I feel my life~ 
				",2004.09.24
X-Japan,J-POP,I'm walking in the rain유끄 아떼모나꾸기즈쯔이 타카라다 누라시가라미쯔꾸 고오리 놋자와메끼코로시쯔즈케테 사마요오이쯔마데모Until I can forget your love네무리와마야끄토호오니끄레타고코로오 시즈카니 도카스마이아가르 아이오 오도라세테후루에르 카라다오 기오쿠노바라니쯔쯔무I keep my lovefor you to myselfEndless rainfall on my heart고코로노 기즈니Let me forgetall of the hateall of the sadnessDays of joydays of sadnessslowly pass me byAs I try to hold youyou are vanishing before meYou're just an illusionWhen I'm awkenmy tears have dried in thesand of sleepI'm a rose blooming in thedesertIt's a dreamI'm in love with you마도로미 다키시메테Endless rainfall on my heart고코로노 기즈니Let me forgetall of the hateall of the sadnessawake from my dreamI can't find my waywithout youThe dream is over코에니나라나이고또바오 꾸리카에시테모다카스기르 하이이로노카베와수기삿타히노 오모이오유메니우츠스Until I can forget you loveEndless rainfall on my heart고코로노 기즈니Let me forgetall of the hateall of the sadnessEndless rainlet me stayevermore in your heartLet my hearttake in your tearstake in your memoriesEndless rainfall on my heart고코로노 기즈니Let me forgetall of the hateall of the sadnessEndless rain ,1989.04.21
조관우,국내드라마,지 아무 생각도 나질 않아 예감할 수 없었던 이별이였기에 그 무슨 말을 했는지 그저 눈물만 흐르네요 믿을 수가 없었던 이별이였기에 무슨 이유로 떠나야 했나요 나보다 더 나를 사랑했던 그대가 왜 나를 떠나야 했는지 아직도 눈물이 남아 있었나요 내 모습이 정말 싫어요 또 다른 사람을 찾아야 하나요 내 이별의 끝은 어디인가요무슨 이유로 떠나야 했나요 나보다 더 나를 사랑했던 그대가 왜 나를 떠나야 했는지 아직도 눈물이 남아 있었나요 내 모습이 정말 싫어요 또 다른 사람을 찾아야 하나요 내 이별의 끝은 어디인가요 ,2004.09.10
Sweetbox,POP,I never really try to be positive I’m too damm busy being negative So focused on what I get And never understand what it means to live You know we all love to just complain But maybe we should try to rearrange There’s always someone Who’s got it worse than you My life is so cool My life is so cool From a different point of view My life is so cool My life is so cool From a different point of view  We’ll all so busy tryin’ to get ahead Got a pillow of fear when we go to bed We’re never satisfied The grass is greener on the other side We`re so distracted with our jealousy Forget it’s in our hands to stop the agony Will you ever be content On your side of the fence? My life is so cool My life is so cool From a different point of view My life is so cool My life is so cool From a different point of view  Maybe you’re the guy who needs a second chance Maybe you’re the girl who’s never asked to dance Maybe you’re lonely soul A single mother scared and all alone Gotta remember we live what we choose It’s not what you say it’s what you do And the life you want is the life you have to make My life is so cool My life is so cool From a different point of view My life is so cool My life is so cool From a different point of view  ,2004.02.04
Kelis,R&B/Soul,"shake brings all the boys to the yard,and there like,its better than yours,damn right its better than yours, i can teach you, but i have to chargeMy milk shake brings all the boys to the yard,and there like,its better than yours,damn right its better than yours, i can teach you, but i have to chargeI know you want it, the thing that makes me, what the guys go crazy for.They lose their minds, the way i wind,i think its timela la-la la la,warm it up.lala-lalala,the boys are waitingla la-la la la,warm it up.lala-lalala,the boys are waitingMy milk shake brings all the boys to the yard,and there like,its better than yours,damn right its better than yours, i can teach you, but i have to chargeMy milk shake brings all the boys to the yard,and there like,its better than yours,damn right its better than yours, i can teach you, but i have to chargei can see youre on it,you want me to teach thetechniques that freaks these boys,it can't be bought,just know, thieves get caught,watch if your smart,la la-la la la,warm it up,la la-la la la,the boys are waitingla la-la la la,warm it up.lala-lalala,the boys are waitingMy milk shake brings all the boys to the yard,and there like,its better than yours,damn right its better than yours, i can teach you, but i have to charge My milk shake brings all the boys to the yard,and there like,its better than yours,damn right its better than yours, i can teach you, but i have to chargeOnce you get involved,everyone will look this way-so,you must maintain your charm,same time maintain your halo,just get the perfect blend,plus what you have within,then next his eyes are squint,then he's picked up your scent,lala-lalala,warm it up,lala-lalala,the boys are waitingla la-la la la,warm it up.lala-lalala,the boys are waitingMy milk shake brings all the boys to the yard,and there like,its better than yours,damn right its better than yours, i can teach you, but i have to charge.My milk shake brings all the boys to the yard,and there like,its better than yours,damn right its better than yours, i can teach you, but i have to charge",2003.12.24
박효신,"발라드, 국내영화",햇살 가득 비춘 날 그 골목길에 언제나 소란스런 아이들 별이 내린 밤이 못내 아쉽던 시절 이제는 추억이 되 버린 풍경 어린 내 투정 까지도 다 받아주던 착하기만 하던 넌 지금 어디에서 날보고 있는지 울진 않는지 아직도 나를 걱정하는지 저 하늘에 걸릴 별이 되 내 눈 속에 살아가려 오늘도 나를 또 찾는지 너무 편해서 그땐 몰라서 보낸 후에야 이렇게 아픈 날 용서해 주겠니 다시 만나면 못 다한 그 말 가슴 깊이 새겨 보여 줄 텐데  함께 발맞추며 걷던 그 거리에는 키 작은 가로 등 만이 남아 혼자 걷는 내게 널데려다 주고 괜찮아 괜찮아 나를 달래지 우린 숨바꼭질 처럼 시간 속으로 숨어들어 갔나봐 꺼낼 수 없는가봐 닿지 못해서 볼 수 없었어 사무치도록 안고 싶어서 바람이 실어준 네 향기 가슴으로 묻는 나를 어디쯤에서 숨어보니 많이 여린 너 많이 닮은 너 곁에 두고도 지키지 못한 날 용서해 주겠니 다시 만나면 묻어둔 그 말 밤새 속삭이며 잠이 들 텐데   ,2004.09.23
Blu Cantrell,R&B/Soul,"While he was schemeingI was beamin in the Beamer just beaminCan't believe that I caught my man cheatin'So I found another way to make him pay for it allSo I wentTo Neiman-Marcus on a shopping spreeAnd on the way I grabbed Soley and MiaAnd as the cash box rang I thought everything away(Oops)There goes the dreams we used to say(oops)There goes the time we spent away(oops)There goes the love I had but you cheated on meAnd thats worth that now(oops)There goes the house we made a home(oops)There goes you'll never leave me alone(oops)For all the lies you toldThis is what you oweHey LadiesWhen your man wanna get buckwildJust go back and Hit 'Em Up StylePut your hands on his cashAnd spend it to the last dimeFor all the hard timesOhWhen you go then everything goesFrom the crib to the ride and the clothesSo you better let him know thatIf he messed up you gotta hit em upWhile he was bragginI was coming down the hill and just dragginAll his pictures and his clothes in the bag andSold everything else till there was just nothin leftAnd I paidAll the bills about a month too lateIt's a shame we have to play these gamesThe love we had just fades away, away(Oops)There goes the dreams we used to say(oops)There goes the time we spent away(oops)There goes the love I had but you cheated on meAnd thats worth that now(oops)There goes the house we made a home(oops)There goes you'll never leave me alone(oops)For all the lies you toldThis is what you oweHey LadiesWhen your man wanna get buckwildJust go back and Hit 'Em Up StylePut your hands on his cashAnd spend it to the last dimeFor all the hard timesOhWhen you go then everything goesFrom the crib to the ride and the clothesSo you better let him know thatIf he messed up you gotta hit em upHey LadiesWhen your man wanna get buckwildJust go back and Hit 'Em Up StylePut your hands on his cashAnd spend it to the last dimeFor all the hard timesOhWhen you go then everything goesFrom the crib to the ride and the clothesSo you better let him know thatIf he messed up you gotta hit em upAll of the dreams you soldLeft me out in the coldWhat happened to the days when we used to trust each otherAnd all of the things I soldWill take you until you get oldTo get 'em back without meCuz it might be better then money or sexHey LadiesWhen your man wanna get buckwildJust go back and Hit 'Em Up StylePut your hands on his cashOhWhen you go then everything goesFrom the crib to the ride and the clothesSo you better let him know thatIf he messed up you gotta hit em upHey Ladieschorus",2001.10.01
Britney Spears,POP,"Baby, can’t you seeI’m callingA guy like youShould wear a warningIt’s dangerousI’m fallin’There’s no escapeI can’t hideI need a hitBaby, give me itYou’re dangerousI’m lovin’ itToo highCan’t come downLosing my headSpinning ‘round and ‘roundDo you feel me nowWith a taste of your lipsI’m on a rideYou’re toxicI’m slipping underWith a taste of poison paradiseI’m addicted to youDon’t you know that you’re toxicAnd I love what you doDon’t you know that you’re toxicIt’s getting lateTo give you upI took a sipFrom my devil cupSlowlyIt’s taking over meToo highCan’t come downIt’s in the airAnd it’s all aroundCan you feel me nowWith a taste of your lipsI’m on a rideYou’re toxicI’m slipping underWith a taste of poison paradiseI’m addicted to youDon’t you know that you’re toxicAnd I love what you doDon’t you know that you’re toxicDon't you know that you're toxicWith a tast of your lipsI'm on a rideYou're toxicI'm slipping underWith a taste of poison paradiseI'm addicted to youDon't you know that you're toxicIntoxicate me nowWith your lovin' nowI think I'm ready nowI think I'm ready nowIntoxicate me nowWith your lovin' nowI'm ready now",2004.11.08
김길중,국내드라마,이제껏 참아온 나의 삶이기에 여기서 이대로 무너질 수 없어 어떤 시련도 다 즐길꺼야 멋대로 맘대로 나를 뭐라지마 피할 수 없다면 내게 주워진 운명이라도 부딪쳐 보는거야 나 쓰러진다 해도 다시 너를 포기하진않아 오오오오오오-너를 위해서 다시 태어난거야 오오오오오오-내인생의 주인공은 나 너만 있으면 돼 거칠게 살아온 그런 나이기에 아픔도 눈물도 내겐 친구였어 어떤 시련도 다 즐길꺼야 멋대로 맘대로 나를 뭐라지마 피할 수 없다면 내게 주워진 운명이라도 오오부딪쳐 보는거야 나 쓰러진다 해도 다시 너를 포기하진않아 오오오오오오-너를 위해서 다시 태어난거야오오오오오오- 내 인생의 주인공은 나 너만 있으면 돼 피할 수 없다면 내게 주워진 운명이라도 부딪쳐 보는거야 나 쓰러진다 해도 다시 너를 포기하진않아오오오오오오-너를 위해서 다시 태어난거야오오오오오오- 내 인생의 주인공은 나 너만 있으면 돼 오오오오오오-후회않겠어 너만 가질 수 있다면오오오오오오- 이제부터 내 세상이야 나를 지켜봐줘 ,2004.09.30
L`Arc-en-Ciel,J-POP,아츠쿠낫타 긴노 메타릭쿠 하토도오카센니 히오 츠케테 아게루후시기나호도 하이나 키분사스나보코리오마키아게테 유코오히메이오 마지라세보오소오스루 코도오메노 마에니와미사이루노 아메아도레나린 즛토 나가시테보쿠노 호오가 오바히토시소오바쿠하츠시테 하이니 낫테모코노마마다토 와랏테루네 킷토마치오 오이코시테코노요노 하테마데붓토바시테 신쥬우시요오사아 테오노바시테치헤이센니 토도쿠요오니켄카이마데 후리킷테쿠레Woh woh woh woh woh ClashInto the rolling morningFlash I'm in thecoolest driver's high사이고노 휘나레오 Yeah모오 카조에루 쿠라이데보쿠라와 키에우세테마쿠라나 아사가 쿠루네오키니이리노 후쿠니 사아키가에타나라 카케다시테아키레루호도 코에오 아게테타이키켄오 톳파시요오제Woh woh woh woh woh ClashInto the rolling morningFlash I'm in thecoolest driver's high하가네노 츠바사테카케누케테요 지칸 키레마데우마레츠키노 스피도쿄오나노사Woh woh woh woh woh ClashInto the rolling morningFlash I'm in thecoolest drivers's high라이세데 마타 아오오 Yeah ,1999.07.01
Usher,R&B/Soul,"Yeah, Yeah Yeah, Yeah yeah, Yeaah Yeah, Yeah yeah, Yeah yeah, Yeaah -I'm in the club with my homies Tryna get a lil V-I Keep it down on the low key Cause you know how it feels I said shorty she was checkin up on me From the game she was spittin my ear You'd think that she knew me So we decided to chill Conversation got heavy She had me feelin like she's ready to blow! (Watch Out!, Watch Out!) She saying come get me (come get me) So I got up and followed her to the floor She said baby lets go When I told her I said Yeah (yeah) Shorty got down to come and get me Yeah (yeah) I got so caught up I forgot she told me Yeah (yeah) Cause if my girl new it'd be best to hold me Yeah (yeah) Next thing I knew she was all up on me screaming Yeah, Yeah yeah, Yeah yeah, Yeaah Yeah, Yeah yeah, Yeah yeah, Yeaah -Shes all up in my head now Got me thinking that it might good idea to take her with me Cause she's ready to leave Now I gotta keep it real now Cause on a one-to-ten she's a certified twenty And that just aint me Cause I don't know If I take that chance just where is it gonna lead But what I do know is the way She dance makes shorty alright with me The way she getting low! I'm like yeah, just work that out for me She asked for one more dance and I'm like yeah How the hell am I supposed to leave? And I said Yeah (yeah) Shorty got down to come and get me Yeah (yeah) I got so caught up I forgot she told me Yeah (yeah) Cause if my girl new it'd be best to hold me Yeah (yeah) Next thing I knew she was all up on me screaming Yeah, Yeah yeah, Yeah yeah, Yeaah Yeah, Yeah yeah, Yeah yeah, Yeaah -Luda! Watch out! My outfit's ridiculous In the club lookin' so conspicuous And Rowl! These women al on the prowl if you hold the head steady I'm a milk the cow Forget about the game I'm a spit the truth I won't stop till I get 'em in they birthday suits So gimmie the rhythm and it'll be off with they clothes then bend over to the front and touch your toes I left the jag and I took the roles if they aint cutting then I put em on foot patrol How you like me now when my pinky's valued over three hundred thousand Lets drank you the one to please Ludacris fill cups like double d's Me and Ush once more and we leave em dead we want a lady in the street but a freak in the bed to say Yeah (yeah) Shorty got down to come and get me Yeah (yeah) I got so caught up I forgot she told me Yeah (yeah) Cause if my girl new it'd be best to hold me Yeah (yeah) Next thing I knew she was all up on me screaming Yeah, Yeah yeah, Yeah yeah, Yeaah Yeah, Yeah yeah, Yeah yeah, Yeaah -Take that and rewind it back, Lil' Jon got the beat that make ya booty go Take that and rewind it back, Usher got the voice that make ya booty go Take that and rewind it back, Ludacris got the flow that make ya booty go Take that and rewind it back, Lil' Jon got the beat that make ya booty go -",2004.03.22
Eurythmics,POP,Sweet dreams are made of thisWho am I to disagreeI travel the world And the seven seasEverybody's looking for somethingSome of them want to use youSome of them want to get used by youSome of them want to abuse youSome of them want to be abusedSweet dreams are made of thisWho am I to disagreeI travel the world And the seven seasEverybody's looking for somethingHold your head upKeep your head up Movin' onHold your head up Movin' onKeep your head up Movin' onHold your head up Movin' onKeep your head up Movin' onHold your head up Movin' onKeep your head up Movin' onSome of them want to use youSome of them want to get used by youSome of them want to abuse youSome of them want to be abusedSweet dreams are made of thisWho am I to disagreeI travel the world And the seven seasEverybody's looking for somethingSweet dreams are made of thisWho am I to disagreeI travel the world And the seven seasEverybody's looking for somethingSweet dreams are made of thisWho am I to disagreeI travel the world And the seven seasEverybody's looking for somethingSweet dreams are made of thisWho am I to disagreeI travel the world And the seven seasEverybody's looking for somethingSweet dreams are made of thisWho am I to disagreeI travel the world And the seven seasEverybody's looking for something,1983
Crystal Kay,J-POP,"eally wanna talk about what I'm feelin' Do you really wanna know about me Or do you want me to say that Everything is ""a-ok"" when It's not what it could be Cuase if ya really wanna know who I am inside Take it to a deeper place and show the world it's mine Do you really wanna know What Makes Me Fall in Love 
When we talk, it's right When we kiss, you know that it's tight we're so close, but still we keep missin' that somethin' that's real 
It's the thought of you lovin me That makes me feel high But I need you to make love to my mind And you say that you're gonna be all that I need Boy, you know that's a lot to be 
To you really wanna talk about what I'm feelin' Do you really wanna know about me Or do you want me to say that Everything is ""a-ok"" when It's not what it could be Cuase if ya really wanna know who I am inside Take it to a deeper place and show the world it's mine Do you really wanna know What Makes Me Fall in Love 
Is it real, then stay If it's not, then go on your way If you need more time It's okay, It's got to be right 
And It's the thought of you lovin me That makes me feel high But I need you to make love to my mind And you say that you're gonna be all that I need Then ya better get to know about me 
To you really wanna talk about what I'm feelin' Do you really wanna know about me Or do you want me to say that Everything is ""a-ok"" when It's not what it could be Cuase if ya really wanna know who I am inside Take it to a deeper place and show the world it's mine Do you really wanna know What Makes Me Fall in Love 
Do you really wanna know what makes my tears fall How to make me laugh when I am side Or what I dream about There's so many things about me That nobody else will ever see But if ya really wanna know What Makes Me Fall in Love
To you really wanna talk about what I'm feelin' Do you really wanna know about me Or do you want me to say that Everything is ""a-ok"" when It's not what it could be Cuase if ya really wanna know who I am inside Take it to a deeper place and show the world it's mine Do you really wanna know What Makes Me Fall in Love 
To you really wanna talk about what I'm feelin' Do you really wanna know about me Or do you want me to say that Everything is ""a-ok"" when It's not what it could be Cuase if ya really wanna know who I am inside Take it to a deeper place and show the world it's mine Do you really wanna know What Makes Me Fall in Love  
Do you really wanna know What Makes Me Fall in Love  ",2003.12.17
Sweetbox,POP,"Do you know?Do you know why your heart stands still?Do you know what you’re looking for?Why your tears dry clear?Do you know why you’re breaking hearts?Why you’re ending up back at the start?Do you know why you’re waking up?The more that we know the less we knowSomewhere, beyond thisSomewhere, I knowThere’s something betterOh, I knowI know, I know, I know, I knowDo you know what you’re fighting for?Why your dreams still bum?Do you know why you wake at night?Why you close your eyes when you should fight?Do you know what you really love?The more that we know the less we knowSomewhere, beyond thisSomewhere, I knowThere’s something betterOh, I knowI know, I know, I know, I knowDo you know why your heart stands still?Do you know what you’re waiting for?Why your heart stands still?Do you know what your limits are?Are you reaching out with open arms?Do you know all your inner truths?The more that we know the less we knowSomewhere, beyond thisSomewhere, I knowThere’s something betterOh, I knowI know, I know, I know, I knowSomewhere, beyond thisSomewhere, I knowThere’s something betterOh, I knowI know, I know, I know, I knowThere’s something betterUh huh",2004.02.04
성시경,"발라드, 국내영화","I tried to keep me in your mind I tried to keep me by your side with all the love and times i share with you You would always find another one, what am I to do  I tried to keep me in your life I tried to keep me close to you even with the love I gave to you I could always find another one, lying close to you  Baby even after all that we've been though l can't live my life alone without your love I can't understand girl, what am I to do but baby it's true  All the love you gave to me All the lies you said to me at night I loves you so it didn't matter than even after all I had, I can't leave you in my past. I will Promise you my love will be so true, forever with you  I tried to keep me in your heart with the pain I felt so deep within With all the love and times I gave you, I could always find another one, lying next to you  Baby even after all that we've been though l even tried to live my life without your love I don't understand girl, what am I to do baby it's true  All the love you gave to me All the lies you said to me at night I loves you so it didn't matter than even after all I had, I can't leave you in my past. I will Promise you my love will be so true, forever with you  If you could understand the way you make me feel Open up your heart and see who's right here waiting by your side I will always be the man for you and Always be the man to love too, All for you!    ",2004.09.23
