artist,genre,lyric,date
강성훈,발라드,이제야 울어요 아파서 우네요 떠나가는 그댈 보며보이지 않는 인사 전해요고운 그대 얼굴 바라보며 한없이 초라한 날 감추네요약속 할래요 행복할거라 울지도 않을 거라 믿어요사랑해서 기쁜 것은 함께 있는 그 순간 뿐이라는걸보는것들 조차 힘겨워질땐 이별은 이미 시작된거죠사랑해줘 고마워요 그걸 너무나도 잘 알기에 잘가라는인사조차도 보이지 않게 하네요그대 행복찾길 잘했네요 그 사랑 보면서 또 인정 하죠내 옆에선 늘 울던 그대가 미소가 그리 아름다울줄....사랑해서 기쁜 것은 함께 있는 그 순간 뿐이라는걸보는것들 조차 힘겨워질땐 이별은 이미 시작된거죠사랑해줘 고마워요 그걸 너무나도 잘 알기에보고픈 만큼 행복을 빌게요 그게 내 맘 이니까사랑해줘 고마워요 한순간도 잊은적 없기에 그대 앞에서고인 눈물까지 보이지 않게 하네요그게 내 마음이니까,2004.03.25
하림,발라드,아무 일도 없는하루 또 하루 가나를 지치게 해보잘 것 없는 일상초라한 평화속숨막혀 하면서사는 동안잃어버린 모든 것은이곳에는 없으니이제 나 떠난다크게 숨쉬며돌아봄 없이내가 가 두었던내 자유를 찾아하늘과 호수들판을 달려파도가 흰 구름을품는 곳으로나 또 다시이곳으로돌아오기 위해서이제 나 떠난다크게 숨쉬며돌아봄 없이내가 가 두었던내 자유를 찾아하늘과 호수들판을 달려파도가 흰 구름을품는 곳으로뚜뚜두룹 뚜뚜두룹 뚜뚜두룹 뚜뚜두룹 내가 가 두었던내 자유를 찾아뚜뚜두룹 뚜뚜두룹 들판을 달려뚜뚜두룹 뚜뚜두룹 뚜뚜두룹 뚜뚜두룹 파도가 흰 구름을품는 곳으로지금 여기보다그 어디엔 가로,2004.04.09
파이브 (F-IV),발라드,너의 곁에 없어도 사랑은 계속될꺼야 널 떠난다고 말해서 I'm Sorry 난 변했다고 말해서 I'm Sorry 차마 얘기할 수 없어서 입가에만 맴돌다 내 안에만 남겨둔 말 I'm Sorry 너무나 사랑했나봐 I'm Sorry 정말 널 사랑했나봐 미안하다는 그말로 이해를 바라기에 한없이 부족한 나를 용서할 수 없었어 I can't ever be your man 더는 자신이 없어 너를 사랑한다면 이젠 놔줘야만 해 Though I wanna be your man 정말 해준게 없어 너무 미안했기에 못한 그말 I'm Sorry 죽을 것 같아도 다시 널 부르면 안돼 이렇게 보내는 날 알면 넌 두번 울게돼 내가 원했던 건 전부 사랑했던 건 모두 나를 떠났기에 너도 잃고 말 것만 같아 I can't ever be your man 더는 자신이 없어 너를 사랑한다면 이젠 놔줘야만 해 Though I wanna be your man 정말 해준게 없어 너무 미안했기에 못한 그말 I'm Sorry 쉽지는 않겠지만 너무 아프겠지만 이대로 가는거야 널 갖고 싶다는 비겁한 내 맘을 잘라내는 그날까지 행복했다는 행복했다는 말도 고마웠다는 말도 전할 수 없는 말로 내 맘속에서 말해 너에 곁에 없어도 사랑할꺼란 말도 돌아서는 눈물로 전해 그말 I'm Sorry 행복했다는 말도 고마웠다는 말도 전할 수 없는 말로 내 맘속에서 말해 너에 곁에 없어도 사랑할꺼란 말도 돌아서는 눈물로 전해 그말 I'm Sorry ,2004.03.31
신승훈,발라드,"이제야 그댈 보내주나요 오래전에 이별이었지만 ",2004.02.03
박효신,발라드,멀리도 돌아왔어오는 길이 늦었어그게 미안했어 항상하지만 니가 없는 건기다려주지 않는 건상상도 못한 일이야니가 있던 자리엔싸늘한 바람만 일어가슴은 너무 아픈데난 울 수도 없겠어너만 향해 왔는데빛을 따라 온 건데이제는 내 모든 게사랑에 묻혀 끝난 거야가라앉을 배처럼지나친 욕심이었나아님 자만이었나절대 안 떠날 너라고하지만 너는 없었어돌아올 곳이 없었어그토록 힘이 들었나너를 사랑한 곳엔너 아닌 그리움 살아잊기엔 너무 많아서난 잊을 수 없겠어너만 보고 온 건데이젠 안 떠날텐데살아갈 희망없는 난 다 끝난 거야조금씩 가라앉을 배처럼이기적인 내 방황이답답했던 내 방황이자꾸 널 떠밀었어니 맘을 아프게 했어니가 있던 자리엔그대로 니가 서있어내가 널 너무 사랑해널 보낼 수 없겠어그냥 함께 갈 거야니가 빛이었으니어차피 너 없는 나는 나 아닌거니기다리겠어 이젠 내가 널 기다려니가 아팠던 바로 그 곳에 서서저 깊이 가라앉을 때까지,2004.04.20
BMK,발라드," 반쯤 감긴 눈에 커피를 벗삼아 하룰 생각하면 너무 빨리가는 시간이 내겐 야속해 everybody be alright-
시간이 멈춰서 이대로였으면 지나는 시간도 내맘 같았으면 인생의 리허설 이런말은 없을거야 
이 도시에 가득한 사람들 무엇을 위해 가고 있는지 누구나 같은 삶의 무게인데 해피한 날 위해 let's go do it now 
One two three four 달려가 너의 인생을 Happy happy 믿어봐 너의 미래를 Life is cool up and down Finally I'll be alright 
Uh! are you ready? One two three to the four 아침에 눈을 뜨는 순간 아직 뭐가 뭔지도 분간하기도 전에 나를 비추는 햇살이 사랑스런 지난 기억은 모두 잊고 이 노랠 들어 yeah 
I'll make you happy You know my name is 래피 And B to the M K with my back 
어쩌다 한번쯤 이곳을 벗어나 술잔을 기울여 날 비춰보지만 고민은 한번에 날려 버리는게 인생 누군가 물었지 내 꿈이 뭐냐고 일상에 길들어 가는 날 바라보며 인생역전이란 꿈을 꾸며 모두 살지 
이 도시에 가득한 사람들 무엇을 위해 가고 있는지 누구나 같은 삶의 무게라면 해피한 우릴 보여줘 워- woo- One two three four 달려가 너의 인생을 Happy happy 불러봐 너의 노래를 Life is cool up and down Finally I'll be alright And happy together now One two three four 달려가 너의 인생을 Happy happy 불러봐 너의 노래를 Life is cool up and down Finally I'll be alright 
(One two three four 달려가) 너의 인생을 (Happy happy 불러봐) 너의 노래를 Up and down be alright-
 ",2003.10.17
고유진 (플라워),발라드,함께 걸으면 손닿지 못할만큼 한참을 뒤에 오던 그녀였죠 빨리 오라며 그녀를 다그치고 답답한 마음에 난 앞서서 걸었는데 천천히 걸을걸 그랬죠 먼저간 날 잃었었는지 그녀가 오질 않네요 하루를 헤매다 돌아온 그녀는 어제보다 많이 다른 모습이죠 날 보며 웃는 미소도 그 향기도 모두 예전과 같은데 낯설은 그대 모습 사소한 일로 많이 다툰 날이었죠  평소와 다른 그녀 모습보고 먼저 다가가 그녈 달래봤지만 내말도 들으려 않은채 울고있죠 사랑하는 사람있다고 허락해 줄수만 있다면 그 사랑 안고 싶다고 고개를 저으면 그저 난 저으면 예전처럼 다시 만날수 있나요 조금 더 함께 하고파 그렇게도 천천히 걷던 그녀를 알지못한 내 죄로 보내야 하나요 그대 혼자서 나를 남겨둔채 가는건 여린 그대가 참 힘든일이라 나 그대 따라서 이별이란 슬픈 세상에 나도 함께 갈께요고개를 저으면 그저 난 저으면 예전처럼 다시 만날 수 있나요 조금 더 함께 하고파 그렇게도 천천히 걷던 그녀를 난 보내야만 하죠 ,2004.04.09
베이비 복스,댄스,"Game cold like the pole in the winter Picturing positions to smash feeling to hither I want in the kitchen on the counter top hit the spot Till the cops start to knock Wake up the whole block How you want it baby On the hood of the car From the back to the front Red hot heels on in the living room in Cancun feel the breeze Strawberries on you stomach to spread the whip cream 날 원하는 걸 알아 그대 어떻게 나를 원해 날 사랑하는 걸 알아 ooh 하지만 천천히 E.Z does it do it easy Touch tease and please me Tell me how you want it However do you need me Passion and ecstasy You're right next to me Tell me all your deepest fantasies Making love till sunrise Holding you so tight How do you want it I'm yours tonight Baby V with the recipe To give real love live it up and rock the party 너와 나 함께 즐기고 싶니 그렇다면 내게 뭔가 보여줘 너와 나 함께 느끼고 싶니 그렇다면 내게 뭔가 보여줘 진짜 나와 함께 달려 보고 싶니 하지만 정신을 잃을걸 ooh baby 그렇게 쉽지는 않지 이제는 그만 나를 놓아줘 이젠 모두 늦어 버렸어 너 내게 빨리 다가와 Step up Step up boy 날 원하는 걸 알아 그대 어떻게 나를 원해 날 사랑하는 걸 알아 ooh 하지만 천천히 날 원하는 걸 알아 그대 어떻게 나를 원해 날 사랑하는 걸 알아 ooh 하지만 천천히 I'm sittin' here, hopin' that we can find some way to kick it even though I got ya diggets gotta struggle to resist it I slowly advance so lest my chance not to miss it You blow my kisses when he ain't lookin at your heart's took it My only whishes that you change your mind and think you should Wanna take you there but you scared to follow come see tomorrow Hoping I can take you through the pain and sorrow let you know I cared And someone's there for your struggle Depend on me when you have needs or there's trouble I wanna give you happiness or maybe even more I told you before no time to waste We can hook up at the store can you get away 진짜 나와 함께 달려보고 싶니 하지만 정신을 잃을걸 ooh baby 그렇게 쉽지는 않지 이제는 그만 나를 놓아줘 이렇게 시간 보내긴 싫어 넌 내게 빨리 달려와 Run up Run up boy 날 원하는 걸 알아 그대 어떻게 나를 원해 날 사랑하는 걸 알아 ohh 하지만 천천히 I know you want me baby So how do you want me I know you love this baby oh real slow baby Move your body Let the music take you out of control Rock the party put it down From LA to Seoul Get it jumping hot like live wire Nobody does it better got the world on fire Floss the overlord Give em what they want more A hundred percent pure Rugged hard-core Pump it in your jeep When you cruise the block Turn the volume up Let the system rock uh We make hits steady chasing the chips International thug dish Can't hate it Just love this world famous collaborate with the greatest 2 Pac and Baby Vox so dangerous I know you want me baby So how do you want me I know you love this baby ooh real slow baby ",2004.03.02
김진표,랩/힙합,"내 나이 여섯살 때 크지 않은 언덕 위에작지만 너무도 예쁜 놀이터 하나 있었었지.거기엔 언제나 혼자, 풀밭에 앉아 예쁜꽃 찾아,노래를 부르던 여자애 하나. 내 맘을 흔들었지.말 한번 하지도 못하고 단 한번에 맘을 뺏겨어린 맘에 찾아든 이상한 감정에 잠까지 뒤척여주먹을 꼭 쥐고 엄마께 말하고그녀와 꼭 결혼 하겠다고. 내 나이 스물 여덟시간은 금새 흘렀는걸동화 속 공주님 같은 얘기는 내게 너무 사치인걸이리로 가다, 때로는 저리 가다계속해 뛰다보면 어느샌가 시간은 흘러이렇게나 미쳐가나지나가는 시간을 잡고한번은 말을 걸고 싶은 건데날 위해 한번만 멈추어 주었으면 좋겠는데내가 꿈꾸는 추억 속으로 떠날 한번의 기회동화 속 공주님을 위해시간은 도대체 어디 살고 있을까매일 같이 넌 달리기만 하잖아혹시 나 몰래 넌 햇볕드는 창에서쉬고 있진 않을까어렸을때 내가 훔친 어머니 지갑 속 오백원되돌려 주지 않은 만화책들이 집에 세 권아무런 이유도 없이 약한 자를 때린건 네 번난 거짓말을 매 번그냥 가책없이 말했던그때 그 장난 가득한 어린시절에도난 계속 사고는 쳤지만 내게 행복만 내 주변에 가득했지만 나 지금 내모습 보며, 쓴 웃음만 또 지며,그때로 돌아가길 간절히 한번 빌어보지만시간은 도대체 어디 살고 있을까매일 같이 넌 달리기만 하잖아혹시 나 몰래 넌 햇볕드는 창에서쉬고 있진 않을까어렸을적 나는 고층건물 유릴 닦고 싶다고그럼 난 하늘을 나는 기분을 느낄 수가 있다고아님 커서 택시 운전사가 난 될꺼라고그럼 난 세상 어디든지 여행 다닐 수 있을꺼라고아니면 난 구멍 가게 주인이 되고 싶다고그럼 난 내가 원하는 과자 마음대로 먹을 수가 있다고이 세 가지중 반드시 한가지는 이루겠다고그렇다고 내 일기장에 적혀있다고시간은 도대체 어디 숨어있을까단 한번만 붙잡고도 싶은데언젠가 나 너를 보게 되는 그 날에내 작은 상자 안에 널 넣어둘꺼야이렇게나 너만 있으면 눈물 흘리지도 않을텐데가슴 아픈 기억들을 모조리 되돌릴텐데또 기억 저편에 보내 저 멀리 나를 보내고 오래 머무르며 그녀의 노래 들을수 있을텐데아마 평생 내가 너를 보는 날은 오지 않겠지세월이 흘러 주름이 지면 너가 말해주겠지난 언제나 항상 너와 함게 했다고다만 니가 몰랐던 것 뿐이라고 ",2004.05.24
리사,R&B/Soul,난 다 알고있는 걸요그대 삶 속에 함께 있던 난데누굴 만나고 또 얼마나가끔 웃고있는지늘 보고있는 것처럼모두 다 느끼죠다 알아요 아파했던걸그대 곁에서 날 떼어내는 일이그대만 믿고 있던그대만 알고 있던 나를 보면꺼내기까지 힘들었죠헤어지자는 그 얘기참 다행스럽죠우리 헤어지고도미운 맘없이 늘 걱정뿐이니항상 고마운걸요기억 속에 이렇게곱게 남아준 그대가 있어서늘 그대가 보고싶었죠하루종일을 그대 생각에 쓰고듣고 싶은 목소리기억하려 한참 애써보지만꿈에도 그댄 안보이죠잘 지내고 있는거죠늘 괜찮았어요 지난 우리 사랑은매일 처음처럼 보고싶으니항상 미안했어요한번 뿐인 그 사랑마지막까지 지키지 못해서깨어나는 일이 두려운 아침에는눈을 감고 그대 얼굴만떠올리곤 하죠내가 그댈 잊지 않고 사는 한늘 우리 사랑은 그대로죠난 다 괜찮아요 그대 없는 오늘도미운 맘 없이늘 걱정스러울 뿐인걸요고마워요기억 안에 이렇게 곱게 남아준그대가 있어서난 언제나 괜찮아요,2003.11.04
신화,R&B/Soul,"Thank you this song is for my friend in my life 눈물로 얼룩진 세상에 버려진 상처뿐인 방어두운 기억의 방에서울고 있는 내게 손 내밀어준 (Just take my hand)One more time 빛으로 다가와얼어버린 가슴 다 녹여준 너내 안에 숨겨져 있던 내 모습 찾을 수 있었어 너로 인해 Thank you for you love You''re the only one for me뜨거운 태양보다 따스한 너의 가슴. 잊지 말아 줘 하나라는 이름을 (Promise we''ll be together) 영원까지 기억될 My friend하나부터 열까지. 머리끝에서부터 발끝까지. 널 본 첨 느낌이 특별해. 모두가 다 변해도 나 안 변해. 손잡아 주먹 꽉 줘. 힘든 일 있으면 같이 해쳐 나가뭐가 문제야.Everybody wanna know what the problem here?yeah yeah How could It be. This is the Destiny. 영원토록 변치 않을 우정. Can''t you see. 우리 처음 만난 때 기억해. 그때처럼 그렇게 변치 않고, 이렇게 높은 하늘 위로 멀리 날아가. Thank you for you love You''re the only one for me뜨거운 태양보다 따스한 너의 가슴. 잊지 말아 줘 하나라는 이름을 (Promise we''ll be together) 영원까지 기억될 My friend다 타버린 불꽃처럼이미 흘러 들어간 내 지난날들.새롭게 타오르려 너와 나 헤아릴 수 없는 별을 함께 노래하면 약속했던 다짐들.수없이 많은 시련이 다가와도 우린 하나라고 지쳐 쓰러져도 우린 함께 한다고.Thank you for you love You''re the only one for me흘린 땀 하나되어 더 높이 날아올라기억해줄래 세상이 준 선물은(I remember you forever)영원까지 함께 할 My friend",2003.12.30
쿨 (COOL),댄스,어떡해 어떡해 어떡해 날.. 어떡해 우-어떡해 그녀 나를 떠나간데 지금껏 나를 사랑만 했는데 항상 내게 이 세상을 늘 사랑할 수 있는 그 소중한 이유를 가르쳐 줬는데 어떡해 어떻게 그녈 보내 까맣게 내 맘 다 타버릴텐데 하얗게 내 앞에 남은 밤을 눈물로 지샐텐데(못 잊을텐데) 사랑해 미안해 그 어떤말도 잡을 수 없기에 삼킬 수 밖에 지금껏 그녀가 내게 말한 모든 것은 다 지켰었기에 어떡해 어떡해 어떡해 날.. 어떡해 우- 언제나 웃음만을 보여주던 그녀가 끝내 울고야 말았지 항상 내게 현실 너머 큰 꿈을 알게 해준 그런 사랑은 세상에 단 하나 뿐인데 어떡해 어떻게 그녈 보내 까맣게 내 맘 다 타버릴텐데 하얗게 내 앞에 남은 이 밤을 눈물로 지샐텐데(잠 못들텐데 ) 내가 널 떠나도 혼자 잘 지내죠 널 걱정하지 않도록 (힘들텐데)어떡해 어떡해 널 떠나야해 이렇게 여린 너를 남겨준채 어떡해 어떡해 난 떠나야해 그렇게 보낸 내맘 힘들텐데 사랑해 미안해 그 어떤 말도 잡을수 없기에 삼킬수 밖에 지금껏 그녀가 내게 말한 모든것을 다 지켰었기에 -,2004.04.19
스위트 피,"인디음악, 록/메탈",바람결에 실려나직이 들리는 종소리찬 바람이 불어유난히 추웠던 그 겨울떠나 보낼 수 밖에 없던아무것도 할 수 없었던 날들하늘이 한 순간검은 구름으로 뒤덮혀그 빛은 잠시흔들린 후에야 사라져달마저 저 버린 세상에이렇게 텅 빈 채로나 홀로 남아무거운 침묵 속으로 빠져들어꿈에서 깨어나도 그대로인걸슬픔에 잠긴 채끊임없는 고통에 전율견딜 수 없었던참을 수 없었던 그리움떠나 보낼 수 밖에 없던아무것도 할 수 없었던그저 지켜볼 수 밖에 없었던 나는한참을 울다 지쳐잠이 들었어지독한 악몽일 거라생각했어하지만 꼭기억하고 있을게요내게 남겨진당신의 그 마음을,2004.04.06
서태지,록/메탈,내가 널널 그렇게 바라보는 걸누구도 이해하진 않지만넌 나를 이해할까So 네 입술 속에 그 속에나의 눈물을 흘리게 해줘난 늘 곁에 네 곁에언제나 너의 옆에난 서있는 걸넌 어째서 네 곁에서있는 날그렇게 차갑게 외면하니난 너만 너만Sorry 미안해지난밤 나의 잘못을후회했어I thought it was overBut it's not over난 또 너의 뒤를난 쫓고 있어더 달려봐더 멀리 뛰어봤자결국 넌 내 앞에 있는걸정말 모르니날 모르니차라리 꺼져버리라고말해 줘 나에게미소를 지어봐날 달래봐제발 나지막이 속삭여줘It's all rightIt's all right네 창가에 가리워진나의 미련을 감싸 안아넌 내 옛 기억엔단 하나의 내 일부분인 걸네 생명이 이슬처럼청명함이 남아 있을 때널 가져가려 해난 이제 너와 단 둘만의소망을 이룰게이 추악한 이 세상에 두터운 밀랍의 성을 짓고난 너와 너와깨끗한 해피앤드,2004.01.27
김범수,발라드,나의 눈이 멀 것 같아 숨이 멎을 것만 같아다시 너를 바라볼 수 없는 거라면살아야 할 이유조차 잃어버린 난이미 죽은 것과 같을테니까왜 그땐 몰랐을까 어떻게 사랑해야 하는지널 갖고 싶어 안으려 애를 써봐도왜 넌 멀어져만 가는지 나의 꿈속에 너는 언제나 찢겨진 날개와 눈물에 얼룩져 있어나는 눈이 멀 것 같아 숨이 멎을 것만 같아다시 너를 느낄 수가 없는 거라면살아야 할 이유조차 잃어버린 난이미 죽은 것과 같을테니까 워-나의 꿈속에 너는 언제나두 손을 잡으면 닿을 듯 사라져 가지내겐 시간마저 멈춰 태양마저 빛을 감춰다시 너를 만질 수도 없는 거라면니가 있어 눈부시던 나의 세상도아무 의미조차 없을테니까 워-다시 한번만 단 한번만 더 기회를 줘아프지 않게 누구보다 더 행복하게 워-너를 위해 웃고 싶어 너를 위해 울고 싶어내 모든 걸 주고 싶은 오직 한 사람이제서야 너의 맘을 알게 됐는데떠나지마 다시 돌아와 내게 내게 내게 -,2004.04.30
한경일,발라드,"그대 오늘도 늦네요할말이 생겼다더니벌써 여러번 문소리만 들려도내 가슴이 내려앉죠잊고 살던 담배가 또 생각나고눈치없이 눈물이 나죠그대 어젯밤 연습했을 한마디참 낯설겠죠 아프겠죠 믿기 싫은데오늘은 날 잊어버려요 여기 오지말아요서글픈 그 말 내 가슴이 듣지 못하게아직 내 안의 그대와 이별은 먼 일이죠긴 여행을 떠나 늦는거라 여길테니화내면서 자꾸 날 걱정하더니실은 미안해서였나요전보다 줄어든 그대 미소 때문에난 더 잘했죠 다 걸었죠 오해였나요오늘은 날 잊어버려요 여기 오지 말아요서글픈 그 말 내 가슴이 듣지 못하게아직 내안의 그대와 이별은 먼 일이죠긴 여행을 떠나 늦는거라 여길테니이렇게 시간에 맡기다보면혹 다시 그대 마음까지 찾을까요 와줄까요이제 그만 돌아갈게요 편히 접어두어요영원히 우리 이별만은 미룰 수 있게그대 눈에서 떠나도 가슴이 사랑하죠만날 수 없어도 추억만은 지킬테니까오늘만은 오지 말아요 
				",2004.03.13
엄정화,댄스,"Senor, siente me mucho mi nueva figuraHombre, divierte mi cambiada corazon나의 두 눈에 맘껏 취해봐나의 입술에 좀더 다가와나의 닫혀진 마음속에 누구라도 담고싶어어떤 무엇도 내게 묻지마오늘 이 밤은 내 멋대로야혹시 사랑이 아니라도 나를 용서 할 수 있어더 이상 눈물은 없어 그렇게 아프긴 싫어그 헛된 어제 일로 나를 버릴순 없어나 홀로 아파 우는 밤 넌 다시 아무일 없듯어딘가 술 한잔에 나를 대신하겠지닫혀진 옷장안에 그동안 숨겨왔던니가 정말 싫어하던 그 옷을 꺼내 입었어더 진한 립스틱에 더 높은 하이힐로나만의 멋에 취해 모두 유혹하고 싶어who's gonna take me away나의 두 눈에 맘껏 취해봐나의 입술에 좀더 다가와나의 닫혀진 마음속에 누구라도 담고싶어어떤 무엇도 내게 묻지마오늘 이 밤은 내 멋대로야혹시 사랑이 아니라도 나를 용서 할 수 있어또 다시 나를 찾아와 아무리 애원해봐도어차피 늦은거야 예전의 내가 아냐그토록 짧은 인연에 이토록 아파했는지이제는 후회뿐인 어리석은 인연뿐멀어진 친구들도 날 반겨 위로하고다시는 너무 쉽게 사랑하지 말라고 해이 넓은 세상안에 인연은 또 있겠지더 멋진 날 만들어 다른 사랑 찾는거야who's gonna show me the away나의 두 눈에 맘껏 취해봐나의 입술에 좀더 다가와나의 닫혀진 마음속에 누구라도 담고싶어어떤 무엇도 내게 묻지마오늘 이 밤은 내 멋대로야혹시 사랑이 아니라도 나를 용서 할 수가 있어Show me, don't close me, right on time I flow G,rhyme on top and grab `em a stake,now baby phone me, everytime I flow on a track and lady slowlyI'll be back home in a sec, and `til I rep baby on이런 나의 모습도 아픔 달랠수 없어아니라고 해도 더욱 붉어지는나의 두 눈가엔 눈물만이who's gonna take me away나의 두 눈에 맘껏 취해봐나의 입술에 좀더 다가와나의 닫혀진 마음속에 누구라도 담고싶어어떤 무엇도 내게 묻지마오늘 이 밤은 내 멋대로야혹시 사랑이 아니라도 나를 용서 할 수가 있어나의 두 눈에 맘껏 취해봐나의 입술에 좀더 다가와나의 닫혀진 마음속에 누구라도 담고싶어어떤 무엇도 내게 묻지마오늘 이 밤은 내 멋대로야혹시 사랑이 아니라도 나를 용서 할 수 있어",2004.02.17
동방신기 (TVXQ!),발라드,"Baby baby baby (있어줘) How can I forget all the special memories of you. Still remember, My little princess. Baby baby baby (있어줘) 사랑이겠죠 이런 내 마음은 숨기려해도 금새 입가엔 미소만 하루도 안돼 또 보고싶어져 어쩌죠 내맘은 깊은 병에 걸린걸 게으른 내 모습 이제 없을꺼에요 좋은 것만 보여주고 싶은걸요 저기 높은 하늘로 날아가 사랑한다고 세상에 말할래 깊은 밤하늘에 꺼지지 않는 girl 너만을 지키는 빛나는 별이 될께요. You're my love 헤어지잔말 행복하란 그 말(괜찮단 그 말) 영원히 우리 절대 하지 않기로 해. 지금처럼만 내 곁에 있어줘 부족한 나인 걸 이해해주길 바래 어른스런 내 모습을 기대해줘요 네게 가장 어울리는 남자가 되고 싶은 걸 언제까지나 그대 맘 속에 내가 들어갈 수 있도록 허락해줘 만일 그대도 나와같다면 아픔은 없죠 이젠 그댈 나 지킬께 for you. (내가 널 얼마나 사랑하는 줄 아니.. 내 곁에 있어줘) My little princess 이제껏 숨겨온 나만의 사랑 늘 보여줄꺼야 영원토록 변치 않는맘으로 girl 내 자신보다 더 더 사랑해줄 거라고 You're my love 약속할께.. 
				",2004.01.14
