artist,genre,lyric,date
장나라,발라드,Baby don't you know it's for you oh~ 귀찮게만 느끼던 그대 얼굴 차창밖을 지나 멀어져 가요 마치 보물처럼 아끼던 모자 변한게 없네요 벌써 코끝시린 계절이 왔죠 우리 헤어지던 그때처럼 조금 우습지만 그럴듯 했었죠 (잘가 정말 미안해) 그대도 힘들었나요 서로가 언제 가야 할지를 몰랐었죠 처음하는 이별 나 먼저 돌아서 버렸죠 내가 미웠겠죠 내가 나빴어요 가지 말라던 그 용기 없던 말을 모른척 했죠 작아지던 목소리 my love 내 맘 아프게 하네요  만화처럼 우린 만나면 싸웠죠 톰과 제리처럼 매일을 항상 이겨야만편했던 내 마음 oh- (그래 내가 미안해) 그대도 힘들었나요 서로가 언제 가야 할지를 몰랐었죠 처음하는 이별 나 먼저 돌아서 버렸죠 내가 미웠겠죠 내가 나빴어요 가지 말라던그 용기 없던 말을 모른척 했죠 작아지던 목소리 my love 내 맘 아프게 하네요 낮은 계단위에 앉아 날 기다리던 모습이 다시 찾아왔으면 해요 기대해 보지만 그대곁엔 누군가가 있네요 내가 미웠겠죠 이제 용서해요 내가 나빴어요 가지말라던 그 용기없던 말을 모른척 했죠 작아지던 목소리 my love 내 맘 아프게 힘들게 만드네요 No no- oh- yeah 모른척 했죠 작아지던 목소리 my love 내 맘 아프게 하네요   ,2002.10.02
제이워크,발라드,baby close your eyes listen to heart n song cause i no fool no more do what love will make u do i wanna heart n song baby my love is so good tell me that u need me i'll always make u smile some day 나 기억해요 우리가 처음 만났던 그날들을 조심스럽게 수줍던 말로 서로를 조금씩 알아가던 때도 있죠 또 궁금해요. 내 어떤점이 그대의 맘 사로잡을 수 있었던 거죠. 말 못하겠죠 나아닌 나를 조금씩 더 익숙해져 가기만 한 그대 가끔 길을 걷다 멈춰서면 나 사실은 겁이나요 내가 살수없는걸 보는 그대인걸 동전하나 남아있다고 하면 그대 떠날껀가요 잡을수 없죠 언제쯤 그대 단 한번만이라도 정말 나를 위해서 웃어줄수 있죠 cause i no fool no more do what love will make u do i wanna heart n song baby my love is so good tell me that u need me i'll always make u smile 그대 그런말을 한적 있었죠 내가 새롭다며 예전 그대 사랑을 비교하던 그대이젠 내가 지겨워졌을까요 매일 늘어만 가는 그대 투정도 그대 스쳐간 저 낙엽 같은 사랑 해가 바뀌면 그대 또 웃을수있겠죠 가끔 다른곳에서 그대소식을 듣겠죠 그대 제발 행복해야만 되요 i want you someday 시간이 흘러 멀리서 그대 바라보고 있는날 쓸쓸이 걷던 그대 뒷모습내 눈앞에 어른거린기만 한데 그대 still loving you ,2002.10.14
언니네 이발관,"인디음악, 록/메탈",우리 헤어지던 날넌 아무렇지도 않게 그냥 걸었어너의 마음 어디쯤에이별을 반기는 마음이 있나 봐너를 아는 정말 많은 사람 중에그 많고 많은 사람 중에널 찾는 이 없어 아무도 없어그걸 왜 모르는 거니사실 이제는 그 누구도볼 수 없을 것만 같은 그런슬픈 마음의 소리 난 들을 수 있어나를 보는 너의 마음 나는 알아그 너의 마음 나는 알아난 가진게 없어 나은 것도 없어그게 뭐 어쨌다는 거니추억이 깊을수록생기 없는 날들이 너무나 힘들어나를 아는 정말 많은 사람 중에그 많고 많은 사람 중에날 찾는 이 없어 아무도 없어그래도 괜찮은 건지 잘 모르겠지만바람이 있다면 나도너희들의 흔한 얘기 나누고 싶어나를 보는 너의 마음 나는 알아그 너의 마음 나는 알아난 가진게 없이 나은 것도 없어그게 뭐 어쨌다는 거니 ,2002.10.17
이소라,발라드,파랗게 비가 개인 날 하늘색 예쁜 구둘 신고 가볍게 나풀대며 그 집 앞을 찾아가첫사랑 니가 사는 곳 좁고 긴 작은 골목길 안 하얀색깔 담 그 위에 내 마음을 적어봐난 그냥 네가 좋아 날 모른대도 좋아언젠가는 알아줘나 널 원하는 사람 나야 나 널 다 아는 사람 기막혀 얼굴 붉혀 하지마 그래도 너만 바라봐반갑게 문을 여는 너 담장에 까만 글씰 보며 수줍은듯 어색하게 웃고만 있었어난 그런 네가 좋아 잘 웃는 네가 좋아 이것만은 알아줘나 널 원하는 사람 나야 나 널 다 아는 사람 기막혀 얼굴 붉혀 하지마 그래도 너만 바라봐 그게 나야널 원하는 사람 나야 나 널 다 아는 사람 기막혀 얼굴 붉혀 하지마 그래도 너만 바라봐 그게 나야 나야나 널 원하는 사람 나야 나 널 다 아는 사람 기막혀 얼굴 붉혀 하지마 그래도 너만 바라봐 그게 나야널 원하는 사람 나야 나 널 다 아는 사람 기막혀 얼굴 붉혀 하지마 그래도 너만 바라봐 그게 나야널 원하는 사람 나야 나 널 다 아는 사람 기막혀 얼굴 붉혀 하지마 그래도 너만 바라봐 그게 나야,2002.10.11
JTL,발라드,우리 처음 만났던 그날이 떠올라 그 길을 또 걷지만 너는 곁에 없는걸하얀 눈이 내리던 그날이 떠올라오늘도 눈이 내려 내 눈에 눈물이 흘러 네가 곁을 떠나 간 후 느낄 수 있는 건너 없는 빈자리가 너무 큰 그리움이란 걸가슴속을 파고드는 아픔이 있는 건 얼마나 많은 밤을 지새며 눈물 흘려야 하나 기억 속에 너의 모습 떠올라 나도 몰라내가 왜 이래야만 하는지왜 자꾸 눈물이 나는지 항상 곁에 있겠다던 네가 날 떠나지 않겠다던 네가 이제 없는 걸 더 크게 느껴지는 걸 후회만이 남아 술에 취해도 몸부림 쳐봐도 이젠 아무 소용 없는 걸 날 떠나간 후 네가 곁을 떠나간 후 느낄수 있는 건 너 없는 빈자리가 너무 큰 그리움 이란 걸 가슴속을 파고드는 아픔이 있는 건 얼마나 많은 밤을 지새며 눈물 흘려야 하나 이젠 너와 내가 되는가 하나였을 때 우린 정말 어떤 어려움도 이겨낼 수 있었는데 행복했던 기억들은 (기억들은) 아픈 추억이 되고 너 없는 빈자리가 너무 큰 그리움이란 걸(그리움이란 걸) 가슴속을 파고드는 아픔이 있는 건 얼마나 많은 밤을 지새며 눈물 흘려야 하나 네가 곁을 떠나간 후 느낄 수 있는 건 가슴속을 파고드는 행복했던 기억은 아픈 추억이 되고... ,2002.12.01
유엔,댄스,넌 언제나 나의 곁에서 항상 꿈을꾸는 그대 천사이길 바래 눈 내리던 어느 겨울 날 영화 속의 주인공처럼 (그 어느날) 하얀 면사포로 얼굴을 가린 수줍은 신부의 모습 (나에게) 사랑의 서약을 말하겠지 많은 사람들 축복속에 Everybody everyody party time yeah-all right all rightEverybody everybody party time yeah- 난 너를 사랑해 넌 나를 모를 꺼야 내 마음이 왜 이렇게 떨려 오는지 너는 몰라 언제까지나 이 순간을 너와 나눌께 덤 덤 치키 치키 치키 치키 치키 덤 덤 치키 덤 치키 덤 덤 치키 덤 오우 워우 yeah 오우 워우 yeah 오우 난 너에게 다가갈수록 고백하고 싶은 그 말 언제나 사랑해 한참동안 생각해왔어 나의 단 한 사람을 위해 (꿈 속에) 네가 만들어 준 아침을 하고 넥타이를 맨 내 모습 (그 어느날) 우리 둘을 닮은 아이와 함께 사는 꿈이 이뤄진다면 Everybody everybody party time yeah all right all right yeah Everybody everybody party time yeah난 너를 사랑해 하늘이 축복해 준 하얀 눈과 눈처럼 아름다운 그대 모습 언제까지나 이 순간을 너와 나눌께 덤 덤 치키 치키 치키 치키 치키 덤 덤 치키 덤 치키 덤 덤 치키 덤 오우 워우 yeah 오우 워우 예예이 워 Everybody everybodyparty time yeah all right all right yeah Everybody everyobdyparty time yeah all right all right,2002.11.14
신승훈,발라드,"그대밖에 모르고 싶죠 그게 행복인걸요",2002.11.20
조규찬,발라드,창백한 아침 햇살이 동산을 맴돌 때나무 위에 새들도 구름마다 흐르네 우집 앞엔 친구들이 내 이름을 부를 때 나도 모르는 기쁨이 내 몸을 감싸네 한여름 날 소나기를 흠뻑 맞은 아이들의 모습에 살며시 미소를 띄어 보내고 뒷산 위에 무지개가 가득히 떠오를 때면 가도 가도 잡히지 않는 무지개를 따라 갔었죠 워 예한여름 날 소나기를 흠뻑 맞은 아이들의 모습에 살며시 미소를 띄어 보내고 뒷산 위에 무지개가 가득히 떠오를 때면 가도 가도 잡히지 않는 무지개를 따라 갔었죠,2002.11.01
YB,록/메탈,나의 하루를 가만히 닫아주는 너은은한 달빛따라 너의 모습 사라지고홀로 남은 골목길에 수줍은 내 마음만나의 아픔을 가만히 안아 주는 너눈물 흘린 시간 뒤엔 언제나 네가 있어상처 받은 내 영혼에 따뜻한 네 손길만처음엔 그냥 친군줄만 알았어아무 색깔 없이 언제나 영원하길또 다시 사랑이라 부르진 않아아무 아픔 없이 너만은 행복하길널 만나면 말없이 있어도또하나의 나처럼 편안했던거야널 만나면 순수한 내모습에철없는 아이처럼 잊었던 거야내겐 너무 소중한너내겐 너무 행복한너처음엔 그냥 친군줄만 알았어아무 색깔 없이 언제나 영원하길또다시 사랑이라 부르진 않아아무 아픔 없이 너만은 행복하길널 만나면 말없이 있어도또하나의 나처럼 편안했던거야널 만나면 순수한 내모습에철없는 아이처럼 잊었던거야널 만나면 말없이 있어도또하나의 나처럼 편안했던거야널 만나면 군수한 내모습에철없는 아이처럼 잊었던거야내겐 너무 소중한너내겐 너무 행복한너,2002.06.27
보아 (BoA),댄스,그대를 바라본 내 모습 그대가 바라본 내 모습 내 미래를 걷어 버리고 그대의 그 손을 잡았어 이른 아침 이슬 맺힌 듯 어린 사랑이라고 해도 마치 불꽃같아 보여도 Oh step in step in baby 우린 어떻게 만난건지 왜 하필 그게 나인건지 Boy I fall in love with you 지금 이 순간도 타이트한 그대의 틀에 맞춰진 사람이 되고도 행복한 나 그 어떤 조그마한 소원이라도 그대에게 기회를 줄래요  My dream 찢어져 있는 청바지와 섬세한 그대의 눈빛도 항상 지켜주고 싶었어 운명처럼 비밀로 했어 소중한 나의 모든것은 내 자신이 지켜줘야해 그곳의 벽을 뛰어 넘고 Oh step in step in baby 무의미한 그 욕심들도 알 수 없는 그 행동까지 Just I fall in love with you 모두 받아 줄께 그대와 나 사이 우리 둘 사이 사랑을 찾을 수 없는 거라면 이 넓은 세상의 어느곳에도 사랑은존재하지 않는 걸 My dream헤어지면 의미 없잖아그냥 함께 있고 싶은걸Boy I fall in love with you이런 날 잡아 줘달리는 고동의 길을 걸어가그대와 내가 택한 이 길 위에그 어떤 알 수 없는 예감 속에서사랑할 수 있게 믿음을 줘 My dream타이트한 그대의 틀에 맞춰진사람이 되고도 행복한 나그 어떤 조그마한 소원이라도그대에게 기회를 줄래요 My dream,2002.09.01
성시경,발라드,눈 뜨지 말아요잠든 채 그냥 있어요그대 눈물 못 본 척 할게요한번만 더 그대의 고운 얼굴을가슴에 새길 수 있게 해줘요날 잡지 말아요내 못난 사랑 안에서그댄 너무 힘들었잖아요내 욕심이 그대를 깨울 수 없게이대로 말없이떠날 수 있게 도와줘요사랑해서 내가 가까이 갈수록그대 맘엔 상처가 깊어져우리는 너무나 닮지 못했죠우리에게 허락된 건그저 바라보는 일거짓을 말할 땐내 눈을 피하던 그댈내가 너무나 잘 알잖아요변함없이 사랑한다는 거짓말오히려 내 맘을병들게 했죠 알잖아요사랑해서 내가 가까이 갈수록그대 맘엔 상처가 깊어져우리는 너무나 닮지 못했죠우리에게 허락된 건그저 바라보는 일혼자 가야 할 그대의 길이힘이 들 땐 나의 이름을 불러요안아줄 수는 없지만그댈 지켜줄 수 있도록가끔씩만 날 찾아줄 순 없나요다른 사람 함께라도 좋아요그대의 모습만 볼 수 있다면괜찮아요 얼마든지견뎌낼 수 있어요나 기다릴게요,2002.07.19
박정현,-,"저 들밖에 한밤중에 양틈에 자던 목자들천사들이 전하여 준 주 나신 소식들었네Noel Noel Noel Noel이스라엘 왕이 나셨네Noel Noel Noel Noel이스라엘 왕이 나셨네The first Noel, the angel did sayWas to certain poor shepherds in fieldsas they layIn fields where they lay keeping their sheepOn a cold winter's night that was so deep잊혀져버린 전설이었나저기 저 하늘엔 그 날처럼 빛나는 별들내게 말해주네 영혼을 넘어성스러운 주님 오신 날을Noel Noel Noel Noel이스라엘 왕이 나셨네Noel Noel Noel Noel이스라엘 왕이 나셨네사람들은 잊었나봐이 밤이 거룩한 이유를잊혀져버린 전설이었나저기 저하늘엔 그날처럼 빛나는 별들내게 말해주네 영혼을 넘어성스러운 주님 오신날을Noel Noel Noel Noel이스라엘 왕이 나셨네Noel Noel Noel Noel이스라엘 왕이 나셨네(반복)
				",2002.12.01
이브,록/메탈,가끔이라도 생각이 날런지 너라는 사람 내곁에 있었던 걸 이해해 마음의 빚이 남아서 잡을 수도 없는 날 잊혀지는 아픔을 견디며 혼자 있어도 웃을 수 있을지 너를 닮은 누군갈 기다려야겠지만 어리석은 짓이지 그래도 살겠지 눈물이 나도 함께여도 편치 않았던 사랑 이거니 이걸 바랬었니 너는 시간에 기대어 지우길 잊겠지 그러다 잊게 되겠지 혼자 남은 서글픈 사실마저 추억이 너의 이름이 지우고 나면 얼굴 조차 잊겠지  어쩌다가 눈을 뜨는 새벽 정말 내곁에 니가 없다는 걸 놀란 나는 몇번씩 너를 불러보지만 부질없는 짓이지 그래도 살겠지 눈물이 나도 함께여도 편치 않았던 사랑 이거니 이걸 바랬었니 너는 시간에 기대어 지우길 잊겠지 그러다 잊게 되겠지 혼자 남은 서글픈 사실마저 추억이 너의 이름이 지우고 나면 얼굴 조차 잊겠지 그걸 바랬던 거니  ,2004.06.25
화요비,R&B/Soul,누구나 한번쯤은 세상을 다 준대도 바꿀 수 없는 사랑해봤겠죠 그러다 보면 시간이 흘러가듯 이별도 찾아 와요 사랑이 깊어 지면 멈출 줄을 모르죠 눈 뜨면 서로밖에 못 보니까 운명의 선이 어긋날 때 쯤 되면 그땐 자신밖에 몰라요끝이 보이면 서두르지 마요 벌써 무너진 가슴이겠지만 생각도 없이 아픔에 지쳐서 소중한 사람 버리려 하진 마요 안아주세요 그의 미움까지 그리고 이렇게 생각해봐요 그 사랑 없이도 나 살 수 있는지 살아갈 이유 없어도 되는 건지 그렇게참았던 투정들이 한껏 밀려왔을 땐 좋았던 기억으로 덮어줘요 만약 헤어지면 영화속 이별처럼 우연히라도 볼 수 있게끝이 보이면 서두르지 마요 벌써 무너진 가슴이겠지만 생각도 없이 아픔에 지쳐서 소중한 사람 버리려 하진 마요 안아 주세요 그의 미움까지 그리고 이렇게 생각해봐요 그 사랑 없이도 나 살 수 있는지 살아갈 이유 없어도 되는 건지 그렇게,2002.10.12
YG Family,랩/힙합,"멋쟁이 신사 나가신다 길을 길을 비켜라 ",2002.10.24
불독 맨션,"인디음악, 록/메탈",네번의 기내식과지루한 미국영화를 본 난적도를 지나며설레는 맘에 창밖을 봐저 언덕과 들판 위내 눈이 머문 곳에나의 그대가 손 흔들고 있네요라따따라따따 baby오후의 열기와뿌연 먼지 바람 속의 난따가운 햇살과낯선 도시의 향기를 느껴저 언덕과 들판 위내 눈이 머문 곳에나의 그대가 손 흔들고 있네요라따따라따 따따라저 태양과 시간 속내 맘이 머문 곳에나의 그대와 손을 잡고 있겠죠라따따라따따 baby잠 siesta 휴일 fiesta그 곳에 난 잠들고 싶어파란 저 언덕과 이 들판 위어딘가의 나의 그대가손 흔들고 있네요 라따따라 따라타오른 저 태양과 이 시간 속어딘가의 나의 그대와손을 잡고 있겠죠 라따따라 따따,2002.09.19
신승훈,발라드,왜 난 단 하루도 완전히 너를 잊지못할까잊어야 할 이유가 너무 많은데이제 나의 곁에 있는게 싫어졌다는 그 말그것 하나만으로 미워할 수도 있을텐데이제 혼자라는 것도 다 널 그리워하며별 수 없이 살아갈 내 모습이 두려워사랑없는 그대의 빈 웃음 마저도그리워지는 내가 싫어왜 난 좋았던 니 모습만 내안에 숨겨두고가끔씩 꺼내보며 아파 해야만 하는걸까다시 너를 볼수 없단 걸 잘 알고있는데모든 순간 내 안에 니가 숨쉬고 있어헤어지던 그 날에 니 얼굴 마저도눈물나도록 보고 싶어매일 아침 너에게 약속하지 널 지운다고사랑한단 그말은 안된다는걸 알고는 있지만얼마나 더 아파야 너의 모든걸 버릴 수 있을까 편안해질까이제 혼자라는 것도 다 널 그리워하며별수 없이 살아갈 내 모습이 두려워사랑없는 그대의 빈 웃음마저도그리워지는 내가 싫어왜 난 좋았던 니 모습만 내안에 숨겨두고가끔씩 꺼내보며 아파해야만 하는걸까... ,2002.11.20
이문세,발라드,열 여섯에처음 날 울리던 노래그때 난 사실 좀 조숙했지만온통 세상이그 목소리처럼참 묘한 느낌의 뭔가 있다는 것을 깨달았지하루에도 몇번은 그 속에 빠져마치 내 얘긴듯 심각했지만왠지 내 인생 그 언제부턴가난 그녀 노래와 인연이 있다는 걸 깨달았지참삶이란 어쩐지 삶이란단순하진 않아참사랑도 여전히 사랑도쉽지만은 않아이제는 정도그 흔한 사랑도다 버릴것 같지만마지막처럼불러보았던언제나 그 노래불러보자한때는 눈물짓던 나그래도 진실했던 나언제나 고향처럼불러보자쓸쓸한 내 모습까지허구한 내 인생까지노래로 불러보자오늘도숨차게 돌아온 하루지친 내 모냥이늘 우습지만역시도 나를반겨주는 건꼭 그녀 노래는 노을 같다는 것을 깨달았지불러보자한때는 눈물짓던 나그래도 진실했던 나언제나 고향처럼불러보자쓸쓸한 내 모습까지허구한 내 인생까지노래로 불러보자불러보자한때는 눈물짓던 나그래도 진실했던 나언제나 고향처럼,2002.10.15
유엔,발라드,"once upon a time this girl of mine she was lovely in all ways and i couldn't let go there were times that go went wrong all i could do was believe in a miracle 누군갈 이렇게 그리워할까 나의 이 마음 그대는 알지 못해도 하지만 난 그래도 상관 없어함께 있을 때나 헤어질 때나 멀리 있어도 그대가 원하는 걸 난 알 수 있죠 돌아가는 그 길을 바래다주다가 짧게 나눈 입맞춤 떨리는 내 손잡고 내게 말해줘요 I love you I do believe in a miracle 영원토록 사랑해요 처음이자 마지막으로 이 세상이 끝나는 그 날까지 내 곁을 떠나가지 마요 날 아프게 하지 말아요 너무 많이(너무 많이) 그대가 많이(그대가 많이) 내 맘을 다 가졌으니 저 문을 열고 처음 들어 오는 그댈 본 순간 심장이 멈출 듯 했던 그 느낌은 말로 다 할 수 없어 1년이 지나가고 세월이 흐르고 늙어 보여도 내 눈엔 항상 예뻐 보여 사랑이란 할수록 깊어 질수록 나는 바보가 되고 첫눈에 사로 잡힌 내 맘을 받아 줘요 tonight tonight tonight tonight I do believe in a miracle영원토록 사랑해요 처음이자 마지막으로 이 세상이 끝난대도 내 곁을 떠나가지 마요 날 아프게 하지 말아요 너무 많이(너무 많이) 그대가 많이(그대가 많이) 내 맘을 다 가졌으니 헤어지긴 너무 아쉬워 자꾸 욕심내고 사랑에 눈이 멀었죠 오 그대 있음에 I do believe in a miracle영원토록 사랑해요 처음이자 마지막으로 이 세상이 끝난대도 내 곁을 떠나가지 마요 날 아프게 하지 말아요 너무 많이(너무 많이) 그대가 많이(그대가 많이) 내 맘을 다 가졌으니 너무 많이 그대가 많이 우-miracle 
 
				",2002.11.14
이기찬,댄스,"오늘만은 용기를 내봐 다음 기회는 없어 우물쭈물 망설이지마 말을 하란 말야 바보야 시간이 없단 말야 말을 해야 니 맘을 알지 Oh my God 어떡해 너의 눈을 본 그 순간 나 얼어버렸어 나 또 얼어버렸어 사랑해 사랑해 널 사랑하고 있다고 말해야 하는데 말이 안나오지 널 원해 널 원해 널 원하고 있다고 왜 말이 안나오는 거야 왜  무슨 얘기라도 괜찮아 일단 말 좀 걸어봐 내가 봐도 정말 답답해 oh my God 난 몰라 너와 마주친 그 순간 온몸에 힘이 풀려 주저앉고 말았어 oh 사랑해 사랑해 널 사랑하고 있다고 말해야 하는데 말이 안나오지 널 원해 널 원해 널 원하고 있다고 왜 말이 안나오는 거야 왜 너무 싫어 싫어 싫어 용기없는 너 정말 싫어 짜증나 짜증나 짜증나 짜증나 짜증나 짜증나 짜증나 Oh my god 난 몰라 너와 마주친 그 순간 온몸에 힘이 풀려 주저앉고 말았어 oh 사랑해 사랑해 널 사랑하고 있다고 말해야 하는데 말이 안나오지 널 원해 널 원해 널 원하고 있다고 왜 말이 안나오는 거야 왜  Oh my God 어떡해 너의 눈을 본 그 순간 나 얼어버렸어 나 또 얼어버렸어 Oh my God 난 몰라 너와 마주친 그 순간 온 몸에 힘이 풀려 주저앉고 말았어 oh I love U love U honey 사랑하고 있다고 말하고 싶은데 말이 안나오니 이게 아닌데 너를 잡아야만 하는데 답답해 미칠 것만 같아 oh~ 사랑해 사랑해 널 사랑하고 있다고 말해야 하는데 말이 안나오지 널 원해 널 원해 널 원하고 있다고 왜 말이 안나오는 거야 왜
				",2002.11.12
크라잉넛 (CRYING NUT),"인디음악, 록/메탈","원 투 쓰리 포",2002.12.05
화요비,발라드,어떤가요 내곁을 떠난 이후로그대 아름다운 모습 그대로 있나요아직까지 당신을 잊는다는게기억 저편으로 보낸다는게너무 힘이 드는데하루종일 비내리는 좁은 골목길에우리 아끼던 음악이 흐르면잠시라도 행복하죠 그럴때면너무 행복한 눈물이 흐르죠가끔씩은 당신도 힘이 드나요사람들에게서 나의 소식도 듣나요당신곁을 지키고 있는 사람이그댈 아프게 하지는 않나요그럴리 없겠지만이젠 모두 끝인가요정말 그런가요우리 약속했던 많은 날들은나를 사랑 했었나요 아닌가요이젠 당신에겐 상관 없겠죠알고 있어요 어쩔수 없었다는걸나만큼이나 당신도 아파했다는걸이젠 모두 끝인가요정말 그런가요우리 약속했던 많은 날들은나를 사랑 했었나요 아닌가요이젠 당신에겐 상관 없겠죠듣고있나요우습게 들릴테지만난 변함없이 아직도 그대를,2002.10.12
비,발라드,"헤어지자는 말이제는그만 만나자는 말 음어쩜 그런 편안한표정과 말투로할 수가 있는 건지어쩜 그렇게 쉬운지헤어지는게 그대에겐아무것도 아닌지어떻게 웃고 있는지즐거웠다는 말그 말이 전분건지내겐 사랑이었죠그대에겐 즐거운시간이었지만내겐 사랑이었죠처음으로 느껴본 사랑난 그댈 만나처음으로 정말행복했죠하지만 그댄알 수 없는 이유로이렇게 내곁을떠나려고 하네요그댄 언제나 이렇게만나고 또 헤어지고이러나요나와 함께 한 시간도그저 또 하나의추억일뿐인가요내겐 사랑이었죠그대에겐 소중한추억이라지만내겐 사랑이었죠처음으로 느껴본 사랑악수를 청하는그대의 손을난 바라보고 서있죠 음이 악수를 하면그댄 돌아서겠죠그럼 난 이제어떡하나요 우 워내겐 사랑이었죠그대에겐 즐거운시간이었지만내겐 사랑이었죠처음으로 느껴본 사랑마지막으로 느낀 사랑
				",2002.05.13
